id,remote_uid,legacy_id,code,chapter,description,is_service,tax_percentage,is_pre_gst,legacy_metadata,created_at,updated_at,is_active
26929,12442,,28380020,2838,"FULMINATES, CYANATES AND THIOCYANATES - FULMINATES, CYANATES AND THIOCYANATES : CYANATES",FALSE,0,FALSE,,,,TRUE
26930,12443,,28380030,2838,"FULMINATES, CYANATES AND THIOCYANATES - FULMINATES, CYANATES AND THIOCYANATES : THIOCYANATES",FALSE,0,FALSE,,,,TRUE
26931,12519,,28470000,2847,"HYDROGEN PEROXIDE, WHETHER OR NOT SOLIDIFIED WITH UREA",FALSE,0,FALSE,,,,TRUE
26932,12521,,28480010,2848,"PHOSPHIDES, WHETHER OR NOT CHEMICALLY DEFINED, EXCLUDING FERROPHOSPHORUS - PHOSPHIDES, WHETHER OR NOT CHEMICALLY DEFINE",FALSE,0,FALSE,,,,TRUE
26933,12522,,28480020,2848,"PHOSPHIDES, WHETHER OR NOT CHEMICALLY DEFINED, EXCLUDING FERROPHOSPHORUS - PHOSPHIDES, WHETHER OR NOT CHEMICALLY DEFINE",FALSE,0,FALSE,,,,TRUE
26934,12523,,28480090,2848,"PHOSPHIDES, WHETHER OR NOT CHEMICALLY DEFINED, EXCLUDING FERROPHOSPHORUS - PHOSPHIDES, WHETHER OR NOT CHEMICALLY DEFINE",FALSE,0,FALSE,,,,TRUE
26935,12535,,28500010,2850,"HYDRIDES, NITRIDES, AZIDES, SILICIDES AND BORIDES, WHETHER OR NOT CHEMICALLY DEFINED, OTHER THAN COMPOUNDS WHICH ARE AL",FALSE,0,FALSE,,,,TRUE
26936,12536,,28500020,2850,"HYDRIDES, NITRIDES, AZIDES, SILICIDES AND BORIDES, WHETHER OR NOT CHEMICALLY DEFINED, OTHER THAN COMPOUNDS WHICH ARE AL",FALSE,0,FALSE,,,,TRUE
26937,12537,,28500041,2850,"HYDRIDES, NITRIDES, AZIDES, SILICIDES AND BORIDES, WHETHER OR NOT CHEMICALLY DEFINED, OTHER THAN COMPOUNDS WHICH ARE AL",FALSE,0,FALSE,,,,TRUE
26938,12538,,28500049,2850,"HYDRIDES, NITRIDES, AZIDES, SILICIDES AND BORIDES, WHETHER OR NOT CHEMICALLY DEFINED, OTHER THAN COMPOUNDS WHICH ARE AL",FALSE,0,FALSE,,,,TRUE
26939,12539,,28500050,2850,"HYDRIDES, NITRIDES, AZIDES, SILICIDES AND BORIDES, WHETHER OR NOT CHEMICALLY DEFINED, OTHER THAN COMPOUNDS WHICH ARE AL",FALSE,0,FALSE,,,,TRUE
26940,12541,,28510010,2851,OTHER INORGANIC COMPOUNDS (INCLUDING DISTILLED OR CONDUCTIVITY WATER AND WATER OF SIMILAR PURITY); LIQUID AIR (WHETHER,FALSE,0,FALSE,,,,TRUE
26941,12542,,28510020,2851,OTHER INORGANIC COMPOUNDS (INCLUDING DISTILLED OR CONDUCTIVITY WATER AND WATER OF SIMILAR PURITY); LIQUID AIR (WHETHER,FALSE,0,FALSE,,,,TRUE
26942,12543,,28510030,2851,OTHER INORGANIC COMPOUNDS (INCLUDING DISTILLED OR CONDUCTIVITY WATER AND WATER OF SIMILAR PURITY); LIQUID AIR (WHETHER,FALSE,0,FALSE,,,,TRUE
26943,12544,,28510040,2851,OTHER INORGANIC COMPOUNDS (INCLUDING DISTILLED OR CONDUCTIVITY WATER AND WATER OF SIMILAR PURITY); LIQUID AIR (WHETHER,FALSE,0,FALSE,,,,TRUE
26944,12545,,28510090,2851,OTHER INORGANIC COMPOUNDS (INCLUDING DISTILLED OR CONDUCTIVITY WATER AND WATER OF SIMILAR PURITY); LIQUID AIR (WHETHER,FALSE,0,FALSE,,,,TRUE
26945,12546,,28510091,2851,CYNOGEN CHLORIDE,FALSE,0,FALSE,,,,TRUE
26946,12547,,28510099,2851,OTHER INORGANIC COMPOUNDS (INCLUDING DISTILLED OR CONDUCTIVITY WATER AND WATER OF SIMILAR PURITY); LIQUID AIR (WHETHER,FALSE,0,FALSE,,,,TRUE
26947,12553,,28530010,2853,OTHER INORGANIC COMPOUNDS (INCLUDING DISTILLED OR CONDUCTIVITY WATER AND WATER OF SIMILAR PURITY); LIQUID AIR (WHETHER,FALSE,0,FALSE,,,,TRUE
26948,12554,,28530020,2853,OTHER INORGANIC COMPOUNDS (INCLUDING DISTILLED OR CONDUCTIVITY WATER AND WATER OF SIMILAR PURITY); LIQUID AIR (WHETHER,FALSE,0,FALSE,,,,TRUE
26949,12555,,28530030,2853,OTHER INORGANIC COMPOUNDS (INCLUDING DISTILLED OR CONDUCTIVITY WATER AND WATER OF SIMILAR PURITY); LIQUID AIR (WHETHER,FALSE,0,FALSE,,,,TRUE
26950,12556,,28530040,2853,OTHER INORGANIC COMPOUNDS (INCLUDING DISTILLED OR CONDUCTIVITY WATER AND WATER OF SIMILAR PURITY); LIQUID AIR (WHETHER,FALSE,0,FALSE,,,,TRUE
26951,12557,,28530091,2853,OTHER INORGANIC COMPOUNDS (INCLUDING DISTILLED OR CONDUCTIVITY WATER AND WATER OF SIMILAR PURITY); LIQUID AIR (WHETHER,FALSE,0,FALSE,,,,TRUE
26952,12558,,28530099,2853,OTHER INORGANIC COMPOUNDS (INCLUDING DISTILLED OR CONDUCTIVITY WATER AND WATER OF SIMILAR PURITY); LIQUID AIR (WHETHER,FALSE,0,FALSE,,,,TRUE
26953,12567,,29012200,2901,ACYCLIC HYDROCARBONS - UNSATURATED : PROPENE (PROPYLENE),FALSE,0,FALSE,,,,TRUE
26954,12584,,2902410,2902,CYCLIC HYDROCARBONS - XYLENES : O-XYLENE,FALSE,0,FALSE,,,,TRUE
26955,12763,,2905410,2905,"ACYCLIC ALCOHOLS AND THEIR HALOGENATED, SULPHONATED, NITRATED OR NITROSATED DERIVATIVES - OTHER POLYHYDRIC ALCOHOLS : 2",FALSE,0,FALSE,,,,TRUE
26956,12770,,2905490,2905,"ACYCLIC ALCOHOLS AND THEIR HALOGENATED, SULPHONATED, NITRATED OR NITROSATED DERIVATIVES - OTHER POLYHYDRIC ALCOHOLS : O",FALSE,0,FALSE,,,,TRUE
26957,12854,,2909410,2909,"ETHERS, ETHER-ALCOHOLS, ETHER-PHENOLS, ETHERALCOHOL- PHENOLS, ALCOHOL PEROXIDES, ETHER PEROXIDES, KETONE PEROXIDES (WHE",FALSE,0,FALSE,,,,TRUE
26958,12859,,2909490,2909,"ETHERS, ETHER-ALCOHOLS, ETHER-PHENOLS, ETHERALCOHOL- PHENOLS, ALCOHOL PEROXIDES, ETHER PEROXIDES, KETONE PEROXIDES (WHE",FALSE,0,FALSE,,,,TRUE
26959,12897,,2912410,2912,"ALDEHYDES, WHETHER OR NOT WITH OTHER OXYGEN FUNCTION; CYCLIC POLYMERS OF ALDEHYDES; PARAFORMALDEHYDE - ALDEHYDE ETHERS,",FALSE,0,FALSE,,,,TRUE
26960,13362,,2922410,2922,"OXYGEN-FUNCTION AMINO-COMPOUNDS - AMINO-ACIDS, OTHER THAN THOSE CONTAINING MORE THAN ONE KIND OF OXYGEN FUNCTION, AND T",FALSE,0,FALSE,,,,TRUE
26961,13569,,2933410,2933,HETEROCYCLIC COMPOUNDS WITH NITROGEN HETEROATOM( S) ONLY - COMPOUNDS CONTAINING IN THE STRUCTURE A QUINOLINE OR ISOQUIN,FALSE,0,FALSE,,,,TRUE
26962,13570,,2933490,2933,HETEROCYCLIC COMPOUNDS WITH NITROGEN HETEROATOM( S) ONLY - COMPOUNDS CONTAINING IN THE STRUCTURE A QUINOLINE OR ISOQUIN,FALSE,0,FALSE,,,,TRUE
26963,13666,,2937220,2937,"HORMONES, PROSTAGLANDINS, THROMBOXANES AND LEUKOTRIENES, NATURAL OR REPRODUCED BY SYNTHESIS; DERIVATIVES AND STRUCTURAL",FALSE,0,FALSE,,,,TRUE
26964,13706,,2939490,2939,"VEGETABLE ALKALOIDS, NATURAL OR REPRODUCED BY SYNTHESIS, AND THEIR SALTS, ETHERS, ESTERS AND OTHER DERIVATIVES - EPHEDR",FALSE,0,FALSE,,,,TRUE
26965,13837,,3003410,3003,CONTAINING EPHEDRINE OR ITS SALTS,FALSE,0,FALSE,,,,TRUE
26966,13840,,3003490,3003,OTHER,FALSE,0,FALSE,,,,TRUE
26967,14414,,3206410,3206,"OTHER COLOURING MATTER; PREPARATIONS AS SPECIFIED IN NOTE 3 TO THIS CHAPTER, OTHER THAN THOSE OF HEADINGS 3203, 3204 OR",FALSE,0,FALSE,,,,TRUE
26968,14657,,3307410,3307,"PRE-SHAVE, SHAVING OR AFTER-SHAVE PREPARATIONS, PERSONAL DEODORANTS, BATH PREPARATIONS, DEPILATORIES AND OTHER PERFUMER",FALSE,0,FALSE,,,,TRUE
26969,14658,,3307490,3307,"PRE-SHAVE, SHAVING OR AFTER-SHAVE PREPARATIONS, PERSONAL DEODORANTS, BATH PREPARATIONS, DEPILATORIES AND OTHER PERFUMER",FALSE,0,FALSE,,,,TRUE
26970,15248,,3825410,3825,"RESIDUAL PRODUCTS OF THE CHEMICAL OR ALLIED INDUSTRIES, NOT ELSEWHERE SPECIFIED OR INCLUDED; MUNICIPAL WASTE; SEWAGE SL",FALSE,0,FALSE,,,,TRUE
26971,15249,,3825490,3825,"RESIDUAL PRODUCTS OF THE CHEMICAL OR ALLIED INDUSTRIES, NOT ELSEWHERE SPECIFIED OR INCLUDED; MUNICIPAL WASTE; SEWAGE SL",FALSE,0,FALSE,,,,TRUE
26972,15825,,4002410,4002,"SYNTHETIC RUBBER AND FACTICE DERIVED FROM OILS, IN PRIMARY FORMS OR IN PLATES, SHEETS OR STRIP; MIXTURES OF ANY PRODUCT",FALSE,0,FALSE,,,,TRUE
26973,15826,,4002490,4002,"SYNTHETIC RUBBER AND FACTICE DERIVED FROM OILS, IN PRIMARY FORMS OR IN PLATES, SHEETS OR STRIP; MIXTURES OF ANY PRODUCT",FALSE,0,FALSE,,,,TRUE
26974,15888,,4009410,4009,"TUBES, PIPES AND HOSES, OF VULCANISED RUBBER OTHER THAN HARD RUBBER, WITH OR WITHOUT THEIR FITTINGS (FOR EXAMPLE, JOINT",FALSE,0,FALSE,,,,TRUE
26975,16085,,4104410,4104,"TANNED OR CRUST HIDES AND SKINS OF BOVINE (INCLUDING BUFFALO) OR EQUINE ANIMALS, WITHOUT HAIR ON, WHETHER OR NOT SPLIT,",FALSE,0,FALSE,,,,TRUE
26976,16086,,4104490,4104,"TANNED OR CRUST HIDES AND SKINS OF BOVINE (INCLUDING BUFFALO) OR EQUINE ANIMALS, WITHOUT HAIR ON, WHETHER OR NOT SPLIT,",FALSE,0,FALSE,,,,TRUE
26977,16092,,4106220,4106,"TANNED OR CRUST HIDES AND SKINS OF OTHER ANIMALS, WITHOUT WOOL OR HAIR ON, WHETHER OR NOT SPLIT BUT NOT FURTHER PREPARE",FALSE,0,FALSE,,,,TRUE
26978,16298,,4403410,4403,"WOOD IN THE ROUGH, WHETHER OR NOT STRIPPED OF BARK OR SAPWOOD, OR ROUGHLY SQUARED - OTHER, OF TROPICAL WOOD SPECIFIED I",FALSE,0,FALSE,,,,TRUE
26979,16826,,4804410,4804,"UNCOATED KRAFT PAPER AND PAPERBOARD, IN ROLLS OR SHEETS, OTHER THAN THAT OF HEADING 4802 OR 4803 - OTHER KRAFT PAPER AN",FALSE,0,FALSE,,,,TRUE
26980,16828,,4804490,4804,"UNCOATED KRAFT PAPER AND PAPERBOARD, IN ROLLS OR SHEETS, OTHER THAN THAT OF HEADING 4802 OR 4803 - OTHER KRAFT PAPER AN",FALSE,0,FALSE,,,,TRUE
26981,16895,,4811410,4811,"PAPER, PAPERBOARD, CELLULOSE WADDING AND WEBS OF CELLULOSE FIBRES, COATED, IMPREGNATED, COVERED, SURFACE-COLOURED, SURF",FALSE,0,FALSE,,,,TRUE
26982,16896,,4811490,4811,"PAPER, PAPERBOARD, CELLULOSE WADDING AND WEBS OF CELLULOSE FIBRES, COATED, IMPREGNATED, COVERED, SURFACE-COLOURED, SURF",FALSE,0,FALSE,,,,TRUE
26983,17449,,5206410,5206,"COTTON YARN (OTHER THAN SEWING THREAD), CONTAINING LESS THAN 85% BY WEIGHT OF COTTON, NOT PUT UP FOR RETAIL SALE - MULT",FALSE,0,FALSE,,,,TRUE
26984,17975,,5402410,5402,"SYNTHETIC FILAMENT YARN (OTHER THAN SEWING THREAD), NOT PUT UP FOR RETAIL SALE, INCLUDING SYNTHETIC MONOFILAMENT OF LES",FALSE,0,FALSE,,,,TRUE
26985,17983,,5402490,5402,"OTHER HIGH TENACITY YARN OF NYLON OR OTHER POLYAMIDES, NOT ELSEWHERE SPECIFIED",FALSE,0,FALSE,,,,TRUE
26986,18411,,5513410,5513,"WOVEN FABRICS OF SYNTHETIC STAPLE FIBRES, CONTAINING LESS THAN 85% BY WEIGHT OF SUCH FIBRES, MIXED MAINLY OR SOLELY WIT",FALSE,0,FALSE,,,,TRUE
26987,18414,,5513490,5513,"WOVEN FABRICS OF SYNTHETIC STAPLE FIBRES, CONTAINING LESS THAN 85% BY WEIGHT OF SUCH FIBRES, MIXED MAINLY OR SOLELY WIT",FALSE,0,FALSE,,,,TRUE
26988,18440,,5514410,5514,"WOVEN FABRICS OF SYNTHETIC STAPLE FIBRES, CONTAINING LESS THAN 85% BY WEIGHT OF SUCH FIBRES, MIXED MAINLY OR SOLELY WIT",FALSE,0,FALSE,,,,TRUE
26989,18443,,5514490,5514,"WOVEN FABRICS OF SYNTHETIC STAPLE FIBRES, CONTAINING LESS THAN 85% BY WEIGHT OF SUCH FIBRES, MIXED MAINLY OR SOLELY WIT",FALSE,0,FALSE,,,,TRUE
26990,18543,,5601220,5601,"WADDING OF TEXTILE MATERIALS AND ARTICLES THEREOF; TEXTILE FIBRES, NOT EXCEEDING 5 MM IN LENGTH (FLOCK), TEXTILE DUST A",FALSE,0,FALSE,,,,TRUE
26991,18586,,5607410,5607,"TWINE, CORDAGE, ROPES AND CABLES, WHETHER OR NOT PLAITED OR BRAIDED AND WHETHER OR NOT IMPREGNATED, COATED, COVERED OR",FALSE,0,FALSE,,,,TRUE
26992,18587,,5607490,5607,"TWINE, CORDAGE, ROPES AND CABLES, WHETHER OR NOT PLAITED OR BRAIDED AND WHETHER OR NOT IMPREGNATED, COATED, COVERED OR",FALSE,0,FALSE,,,,TRUE
26993,18967,,6001220,6001,"PILE FABRICS, INCLUDING LONG PILE FABRICS AND TERRY FABRICS, KNITTED OR CROCHETED - LOOPED PILE FABRICS:OF MAN-MADE FIB",FALSE,0,FALSE,,,,TRUE
26994,19000,,6005410,6005,"WARP KNIT FABRICS (INCLUDING THOSE MADE ON GALLOON KNITTING MACHINES), OTHER THAN THOSE OF HEADINGS 6001 TO 6004 - OF A",FALSE,0,FALSE,,,,TRUE
26995,19015,,6006410,6006,OTHER KNITTED OR CROCHETED FABRICS- OF ARTIFICIAL FIBRES : UNBLEACHED OR BLEACHED,FALSE,0,FALSE,,,,TRUE
26996,19097,,6103410,6103,"MENS OR BOYS SUITS, ENSEMBLES, JACKETS, BLAZERS, TROUSERS, BIB AND BRACE OVERALLS, BREECHES AND SHORTS (OTHER THAN SWIM",FALSE,0,FALSE,,,,TRUE
26997,19126,,6104410,6104,"WOMENS OR GIRLS SUITS, ENSEMBLES, JACKETS, BLAZERS, DRESSES, SKIRTS, DIVIDED SKIRTS, TROUSERS, BIB AND BRACE OVERALLS,",FALSE,0,FALSE,,,,TRUE
26998,19267,,6112410,6112,"TRACK SUITS, SKI SUITS AND SWIMWEAR, KNITTED OR CROCHETED WOMENS OR GIRLS SWIMWEAR : OF SYNTHETIC FIBRE",FALSE,0,FALSE,,,,TRUE
26999,19398,,6203410,6203,"MENS OR BOYS SUITS, ENSEMBLES, JACKETS, BLAZERS, TROUSERS, BIB AND BRACE OVERALLS, BREECHES AND SHORTS (OTHER THAN SWIM",FALSE,0,FALSE,,,,TRUE
27000,19764,,6306410,6306,"TARPAULINS, AWNINGS AND SUNBLINDS; TENTS; SAILS FOR BOATS, SAILBOARDS OR LANDCRAFT; CAMPING GOODS PNEUMATIC MATTRESSES:",FALSE,0,FALSE,,,,TRUE
27001,19765,,6306490,6306,"TARPAULINS, AWNINGS AND SUNBLINDS; TENTS; SAILS FOR BOATS, SAILBOARDS OR LANDCRAFT; CAMPING GOODS PNEUMATIC MATTRESSES:",FALSE,0,FALSE,,,,TRUE
27002,20303,,7013410,7013,"GLASSWARE OF A KIND USED FOR TABLE, KITCHEN, TOILET, OFFICE, INDOOR DECORATION OR SIMILAR PURPOSES (OTHER THAN THAT OF",FALSE,0,FALSE,,,,TRUE
27003,20305,,7013490,7013,"GLASSWARE OF A KIND USED FOR TABLE, KITCHEN, TOILET, OFFICE, INDOOR DECORATION OR SIMILAR PURPOSES (OTHER THAN THAT OF",FALSE,0,FALSE,,,,TRUE
27004,20387,,7101220,7101,"PEARLS, NATURAL OR CULTURED, WHETHER OR NOT WORKED OR GRADED BUT NOT STRUNG, MOUNTED OR SET; PEARLS, NATURAL OR CULTURE",FALSE,0,FALSE,,,,TRUE
27005,20499,,7110410,7110,"PLATINUM, UNWROUGHT OR IN SEMI-MANUFACTURED FORM, OR IN POWDER FORM - IRIDIUM, OSMIUM AND RUTHENIUM: UNWROUGHT OR IN PO",FALSE,0,FALSE,,,,TRUE
27006,20500,,7110490,7110,"PLATINUM, UNWROUGHT OR IN SEMI-MANUFACTURED FORM, OR IN POWDER FORM - IRIDIUM, OSMIUM AND RUTHENIUM: OTHER",FALSE,0,FALSE,,,,TRUE
27007,20578,,7202410,7202,FERRO-ALLOYS - FERRO-CHROMIUM : CONTAINING BY WEIGHT MORE THAN 4% OF CARBON,FALSE,0,FALSE,,,,TRUE
27008,20579,,7202490,7202,FERRO-ALLOYS - FERRO-CHROMIUM : OTHER,FALSE,0,FALSE,,,,TRUE
27009,20612,,7204490,7204,FERROUS WASTE AND SCRAP; REMELTING SCRAP INGOTS OF IRON OR STEEL - OTHER WASTE AND SCRAP : OTHER,FALSE,0,FALSE,,,,TRUE
27010,20787,,7210410,7210,"FLAT-ROLLED PRODUCTS OF IRON OR NON-ALLOY STEEL, OF A WIDTH OF 600 MM OR MORE, CLAD, PLATED OR COATED - OTHERWISE PLATE",FALSE,0,FALSE,,,,TRUE
27011,20788,,7210490,7210,"FLAT-ROLLED PRODUCTS OF IRON OR NON-ALLOY STEEL, OF A WIDTH OF 600 MM OR MORE, CLAD, PLATED OR COATED - OTHERWISE PLATE",FALSE,0,FALSE,,,,TRUE
27012,21264,,7304410,7304,"TUBES, PIPES AND HOLLOW PROFILES, SEAMLESS, OF IRON (OTHER THAN CAST IRON) OR STEEL - OTHER, OF CIRCULAR CROSS-SECTION,",FALSE,0,FALSE,,,,TRUE
27013,21651,,7410220,7410,"COPPER FOIL (WHETHER OR NOT PRINTED OR BACKED WITH PAPER, PAPERBOARD, PLASTICS OR SIMILAR BACKING MATERIALS) OF A THICK",FALSE,0,FALSE,,,,TRUE
27014,21655,,7411220,7411,COPPER TUBES AND PIPES - OF COPPER ALLOYS : OF COPPER-NICKEL BASE ALLOYS (CUPRO-NICKEL) OR COPPER-NICKEL-ZINC BASE ALLO,FALSE,0,FALSE,,,,TRUE
27015,21743,,7505220,7505,"NICKEL BARS, RODS, PROFILES AND WIRE - WIRE : OF NICKEL ALLOYS",FALSE,0,FALSE,,,,TRUE
27016,22257,,8302490,8302,"BASE METAL MOUNTINGS, FITTINGS AND SIMILAR ARTICLES SUITABLE FOR FURNITURE, DOORS, STAIRCASES, WINDOWS, BLINDS, COACHWO",FALSE,0,FALSE,,,,TRUE
27017,22683,,8425410,8425,PULLEY TACKLE AND HOISTS OTHER THAN SKIP HOISTS; WINCHES AND CAPSTANS; JACKS - JACKS; HOISTS OF A KIND USED FOR RAISING,FALSE,0,FALSE,,,,TRUE
27018,22685,,8425490,8425,PULLEY TACKLE AND HOISTS OTHER THAN SKIP HOISTS; WINCHES AND CAPSTANS; JACKS - JACKS; HOISTS OF A KIND USED FOR RAISING,FALSE,0,FALSE,,,,TRUE
27019,22692,,8426410,8426,"SHIPS DERRICKS; CRANES INCLUDING CABLE CRANES; MOBILE LIFTING FRAMES, STRADDLE CARRIERS AND WORKS TRUCKS FITTED WITH A",FALSE,0,FALSE,,,,TRUE
27020,22693,,8426490,8426,"SHIPS DERRICKS; CRANES INCLUDING CABLE CRANES; MOBILE LIFTING FRAMES, STRADDLE CARRIERS AND WORKS TRUCKS FITTED WITH A",FALSE,0,FALSE,,,,TRUE
27021,22754,,8430490,8430,"OTHER MOVING, GRADING, LEVELLING, SCRAPING, EXCAVATING, TAMPING, COMPACTING, EXTRACTING OR BORING MACHINERY, FOR EARTH,",FALSE,0,FALSE,,,,TRUE
27022,22769,,8431410,8431,PARTS SUITABLE FOR USE SOLELY OR PRINCIPALLY WITH THE MACHINERY OF HEADINGS 8425 TO 8430 - OF MACHINERY OF HEADING 8426,FALSE,0,FALSE,,,,TRUE
27023,22793,,8432410,8432,MANURE SPREADERS,FALSE,0,FALSE,,,,TRUE
27024,23182,,8455220,8455,METAL-ROLLING MILLS AND ROLLS THEREFOR - OTHER ROLLING MILLS: COLD,FALSE,0,FALSE,,,,TRUE
27025,23367,,8462410,8462,"MACHINE-TOOLS (INCLUDING PRESSES) FOR WORKING METAL BY FORGING, HAMMERING OR DIE-STAMPING; MACHINE-TOOLS (INCLUDING PRE",FALSE,0,FALSE,,,,TRUE
27026,23490,,8471490,8471,"AUTOMATIC DATA PROCESSING MACHINES AND UNITS THEREOF; MAGNETIC OR OPTICAL READERS, MACHINES FOR TRANSCRIBING DATA ON TO",FALSE,0,FALSE,,,,TRUE
27027,23632,,8480410,8480,"MOULDING BOXES FOR METAL FOUNDRY; MOULD BASES; MOULDING PATTERNS; MOULDS FOR METAL (OTHER THAN INGOT MOULDS), METAL CAR",FALSE,0,FALSE,,,,TRUE
27028,23633,,8480490,8480,"MOULDING BOXES FOR METAL FOUNDRY; MOULD BASES; MOULDING PATTERNS; MOULDS FOR METAL (OTHER THAN INGOT MOULDS), METAL CAR",FALSE,0,FALSE,,,,TRUE
27029,24265,,8528410,8528,"MONITORS AND PROJECTORS, NOT INCORPORATING TELEVISION RECEPTION APPARATUS. RECEPTION APPARATUS FOR TELEVISION, WHETHER",FALSE,0,FALSE,,,,TRUE
27030,24267,,8528490,8528,"MONITORS AND PROJECTORS, NOT INCORPORATING TELEVISION RECEPTION APPARATUS. RECEPTION APPARATUS FOR TELEVISION, WHETHER",FALSE,0,FALSE,,,,TRUE
27031,24409,,8536410,8536,"ELECTRICAL APPARATUS FOR SWITCHING OR PROTECTING ELECTRICAL CIRCUITS, OR FOR MAKING CONNECTIONS TO OR IN ELECTRICAL CIR",FALSE,0,FALSE,,,,TRUE
27032,24452,,8539410,8539,"ELECTRIC FILAMENT OR DISCHARGE LAMPS, INCLUDING SEALED BEAM LAMP UNITS AND ULTRA-VIOLET OR INFRA RED LAMPS; ARC-LAMPS -",FALSE,0,FALSE,,,,TRUE
27033,10217,,82055110,8205,"HAND TOOLS (INCLUDING GLAZIERS DIAMONDS), NOT ELSEWHERE SPECIFIED OR INCLUDED; BLOW LAMPS; VICES; CLAMPS AND THE LIKE, O",FALSE,0,FALSE,,,,TRUE
27034,10575,,12115000,1211,EPHEDRA,FALSE,0,FALSE,,,,TRUE
27035,10928,,16023200,1602,"OTHER PREPARED OR PRESERVED MEAT, MEAT OFFAL OR BLOOD OF POULTRY OF HEADING 0105 : OF FOWLS OF THE SPECIES GALLUS DOMES",FALSE,0,FALSE,,,,TRUE
27036,10961,,16043200,1604,PREPARED OR PRESERVED FISH; CAVIAR AND CAVIAR SUBSTITUTES PREPARED FROM FISH EGGS- CAVIAR AND CAVIAR SUBSTITUTES -- CAV,FALSE,0,FALSE,,,,TRUE
27037,10992,,16056900,1605,"CRUSTACEANS, MOLLUSCS AND OTHER AQUATIC INVERTEBRATES, PREPARED OR PRESERVED-OTHER AQUATIC INVERTEBRATES--OTHER",FALSE,0,FALSE,,,,TRUE
27038,11029,,17025000,1702,"OTHER SUGARS, INCLUDING CHEMICALLY PURE LACTOSE, MALTOSE, GLUCOSE AND FRUCTOSE, IN SOLID FORM; SUGAR SYRUPS NOT CONTAIN",FALSE,0,FALSE,,,,TRUE
27039,11067,,18063200,1806,"CHOCOLATE AND OTHER FOOD PREPARATIONS CONTAINING COCOA - OTHER, IN BLOCKS, SLABS OR BARS : NOT FILLED",FALSE,0,FALSE,,,,TRUE
27040,11169,,20085000,2008,"FRUIT, NUTS AND OTHER EDIBLE PARTS OFPLANTS, OTHERWISE PREPARED OR PRESERVED, WHETHER OR NOT CONTAINING ADDED SUGAR ORO",FALSE,0,FALSE,,,,TRUE
27041,11201,,20096900,2009,"FRUIT JUICES (INCLUDING GRAPE MUST) ANDVEGETABLE JUICES, UNFERMENTED AND NOTCONTAINING ADDED SPIRIT, WHETHER OR NOTCONT",FALSE,0,FALSE,,,,TRUE
27042,12112,,28046900,2804,"HYDROGEN, RARE GASES AND OTHER NON-METALS - SILICON : OTHER",FALSE,0,FALSE,,,,TRUE
27043,12283,,28273200,2827,"CHLORIDES, CHLORIDE OXIDES AND CHLORIDE HYDROXIDES; BROMIDES AND BROMIDE OXIDES; IODIDES AND IODIDE OXIDES - OTHER CHLO",FALSE,0,FALSE,,,,TRUE
27044,12467,,28416900,2841,"SALTS OF OXOMETALLIC OR PEROXOMETALLIC ACIDS - MANGANITES, MANGANATES AND PERMANGANATES : OTHER",FALSE,0,FALSE,,,,TRUE
27045,12704,,2904320,2904,AMMONIUM PERFLUOROOCTANE SULPHONATE,FALSE,0,FALSE,,,,TRUE
27046,12758,,2905320,2905,"ACYCLIC ALCOHOLS AND THEIR HALOGENATED, SULPHONATED, NITRATED OR NITROSATED DERIVATIVES - DIOLS : PROPYLENE GLYCOL (PRO",FALSE,0,FALSE,,,,TRUE
27047,12771,,2905510,2905,"ACYCLIC ALCOHOLS AND THEIR HALOGENATED, SULPHONATED, NITRATED OR NITROSATED DERIVATIVES - HALOGENATED, SULPHONATED, NIT",FALSE,0,FALSE,,,,TRUE
27048,12974,,2915320,2915,"SATURATED ACYCLIC MONOCARBOXYLIC ACIDS AND THEIR ANHYDRIDES, HALIDES, PEROXIDES AND PEROXYACIDS; THEIR HALOGENATED, SUL",FALSE,0,FALSE,,,,TRUE
27049,12996,,2915500,2915,"SATURATED ACYCLIC MONOCARBOXYLIC ACIDS AND THEIR ANHYDRIDES, HALIDES, PEROXIDES AND PEROXYACIDS; THEIR HALOGENATED, SUL",FALSE,0,FALSE,,,,TRUE
27050,13057,,2916320,2916,"UNSATURATED ACYCLIC MONOCARBOXYLIC ACIDS, CYCLIC MONOCARBOXYLIC ACIDS, THEIR ANHYDRIDES, HALIDES, PEROXIDES AND PEROXYA",FALSE,0,FALSE,,,,TRUE
27051,13091,,2917320,2917,"POLYCARBOXYLIC ACIDS, THEIR ANHYDRIDES, HALIDES, PEROXIDES AND PEROXYACIDS; THEIR HALOGENATED, SULPHONATED, NITRATED OR",FALSE,0,FALSE,,,,TRUE
27052,13499,,2931320,2931,DIMETHYL PROPYLPHOSPHONATE,FALSE,0,FALSE,,,,TRUE
27053,13553,,2933320,2933,HETEROCYCLIC COMPOUNDS WITH NITROGEN HETEROATOM( S) ONLY - COMPOUNDS CONTAING AN UNFUSED PYRIDINE RING (WHETHER OR NOT,FALSE,0,FALSE,,,,TRUE
27054,13707,,2939510,2939,"VEGETABLE ALKALOIDS, NATURAL OR REPRODUCED BY SYNTHESIS, AND THEIR SALTS, ETHERS, ESTERS AND OTHER DERIVATIVES - THEOPH",FALSE,0,FALSE,,,,TRUE
27055,13716,,2939690,2939,"VEGETABLE ALKALOIDS, NATURAL OR REPRODUCED BY SYNTHESIS, AND THEIR SALTS, ETHERS, ESTERS AND OTHER DERIVATIVES - ALKALO",FALSE,0,FALSE,,,,TRUE
27056,15045,,3808500,3808,"NSECTICIDES, RODENTICIDES, FUNGICIDES, HERBICIDES, ANTI-SPROUTING PRODUCTS AND PLANT-GROWTH REGULATORS, DISINFECTANTS A",FALSE,0,FALSE,,,,TRUE
27057,15050,,3808690,3808,OTHER,FALSE,0,FALSE,,,,TRUE
27058,15252,,3825690,3825,"RESIDUAL PRODUCTS OF THE CHEMICAL OR ALLIED INDUSTRIES, NOT ELSEWHERE SPECIFIED OR INCLUDED; MUNICIPAL WASTE; SEWAGE SL",FALSE,0,FALSE,,,,TRUE
27059,15348,,3907500,3907,"POLYACETALS, OTHER POLYETHERS AND EPOXIDE RESINS, IN PRIMARY FORMS; POLYCARBONATES, ALKYD RESINS, POLYALLYLESTERS AND O",FALSE,0,FALSE,,,,TRUE
27060,15827,,4002510,4002,"SYNTHETIC RUBBER AND FACTICE DERIVED FROM OILS, IN PRIMARY FORMS OR IN PLATES, SHEETS OR STRIP; MIXTURES OF ANY PRODUCT",FALSE,0,FALSE,,,,TRUE
27061,15887,,4009320,4009,"TUBES, PIPES AND HOSES, OF VULCANISED RUBBER OTHER THAN HARD RUBBER, WITH OR WITHOUT THEIR FITTINGS (FOR EXAMPLE, JOINT",FALSE,0,FALSE,,,,TRUE
27062,15945,,4011690,4011,"NEW PNEUMATIC TYRES, OF RUBBER - OTHER, HAVING A HERRING-BONE OR SIMILAR TREAD : OTHER",FALSE,0,FALSE,,,,TRUE
27063,16094,,4106320,4106,"TANNED OR CRUST HIDES AND SKINS OF OTHER ANIMALS, WITHOUT WOOL OR HAIR ON, WHETHER OR NOT SPLIT BUT NOT FURTHER PREPARE",FALSE,0,FALSE,,,,TRUE
27064,16829,,4804510,4804,"UNCOATED KRAFT PAPER AND PAPERBOARD, IN ROLLS OR SHEETS, OTHER THAN THAT OF HEADING 4802 OR 4803 - OTHER KRAFT PAPER AN",FALSE,0,FALSE,,,,TRUE
27065,16885,,4810320,4810,"PAPER AND PAPERBOARD, COATED ON ONE OR BOTH SIDES WITH KAOLIN (CHINA CLAY) OR OTHER INORGANIC SUBSTANCES, WITH OR WITHO",FALSE,0,FALSE,,,,TRUE
27066,17000,,4823690,4823,"OTHER PAPER, PAPERBOARD, CELLULOSE WADDING AND WEBS OF CELLULOSE FIBRES, CUT TO SIZE OR SHAPE; OTHER ARTICLES OF PAPER",FALSE,0,FALSE,,,,TRUE
27067,17445,,5206320,5206,"COTTON YARN (OTHER THAN SEWING THREAD), CONTAINING LESS THAN 85% BY WEIGHT OF COTTON, NOT PUT UP FOR RETAIL SALE - MULT",FALSE,0,FALSE,,,,TRUE
27068,17968,,5402320,5402,"SYNTHETIC FILAMENT YARN (OTHER THAN SEWING THREAD), NOT PUT UP FOR RETAIL SALE, INCLUDING SYNTHETIC MONOFILAMENT OF LES",FALSE,0,FALSE,,,,TRUE
27069,17984,,5402510,5402,"SYNTHETIC FILAMENT YARN (OTHER THAN SEWING THREAD), NOT PUT UP FOR RETAIL SALE, INCLUDING SYNTHETIC MONOFILAMENT OF LES",FALSE,0,FALSE,,,,TRUE
27070,18007,,5403320,5403,"ARTIFICIAL FILAMENT YARN (OTHER THAN SEWING THREAD), NOT PUT FOR RETAIL SALE, INCLUDING ARTIFICIAL MONO FILAMENT OF LES",FALSE,0,FALSE,,,,TRUE
27071,18320,,5509320,5509,"YARN (OTHER THAN SEWING THREAD) OF SYNTHETIC STAPLE FIBRES, NOT PUT UP FOR RETAIL SALE - CONTAINING 85% OR MORE BY WEIG",FALSE,0,FALSE,,,,TRUE
27072,18331,,5509510,5509,"YARN (OTHER THAN SEWING THREAD) OF SYNTHETIC STAPLE FIBRES, NOT PUT UP FOR RETAIL SALE - OTHER YARN, OF POLYESTER STAPL",FALSE,0,FALSE,,,,TRUE
27073,18337,,5509690,5509,"YARN (OTHER THAN SEWING THREAD) OF SYNTHETIC STAPLE FIBRES, NOT PUT UP FOR RETAIL SALE - OTHER YARN, OF ACRYLIC OR MODA",FALSE,0,FALSE,,,,TRUE
27074,18408,,5513320,5513,"WOVEN FABRICS OF SYNTHETIC STAPLE FIBRES, CONTAINING LESS THAN 85% BY WEIGHT OF SUCH FIBRES, MIXED MAINLY OR SOLELY WIT",FALSE,0,FALSE,,,,TRUE
27075,18437,,5514320,5514,"WOVEN FABRICS OF SYNTHETIC STAPLE FIBRES, CONTAINING LESS THAN 85% BY WEIGHT OF SUCH FIBRES, MIXED MAINLY OR SOLELY WIT",FALSE,0,FALSE,,,,TRUE
27076,18523,,5516320,5516,"WOVEN FABRICS OF ARTIFICIAL STAPLE FIBRES - CONTAINING LESS THAN 85% BY WEIGHT OF ARTIFICIAL STAPLE FIBRES, MIXED MAINL",FALSE,0,FALSE,,,,TRUE
27077,18749,,5801320,5801,"WOVEN PILE FABRICS AND CHENILLE FABRICS, OTHER THAN FABRICS OF HEADING 5802 OR 5806 - OF MAN-MADE FIBRES: CUT CORDUROY",FALSE,0,FALSE,,,,TRUE
27078,18816,,5806320,5806,NARROW WOVEN FABRICS OTHER THAN GOODS OF HEADING 5807; NARROW FABRICS CONSISTING OF WARP WITHOUT WEFT ASSEMBLED BY MEAN,FALSE,0,FALSE,,,,TRUE
27079,18992,,6005320,6005,"WARP KNIT FABRICS (INCLUDING THOSE MADE ON GALLOON KNITTING MACHINES), OTHER THAN THOSE OF HEADINGS 6001 TO 6004 - OF S",FALSE,0,FALSE,,,,TRUE
27080,19012,,6006320,6006,OTHER KNITTED OR CROCHETED FABRICS- OF SYNTHETIC FIBRES: DYED,FALSE,0,FALSE,,,,TRUE
27081,19091,,6103320,6103,"MENS OR BOYS SUITS, ENSEMBLES, JACKETS, BLAZERS, TROUSERS, BIB AND BRACE OVERALLS, BREECHES AND SHORTS (OTHER THAN SWIM",FALSE,0,FALSE,,,,TRUE
27082,19120,,6104320,6104,"WOMENS OR GIRLS SUITS, ENSEMBLES, JACKETS, BLAZERS, DRESSES, SKIRTS, DIVIDED SKIRTS, TROUSERS, BIB AND BRACE OVERALLS,",FALSE,0,FALSE,,,,TRUE
27083,19133,,6104510,6104,"WOMENS OR GIRLS SUITS, ENSEMBLES, JACKETS, BLAZERS, DRESSES, SKIRTS, DIVIDED SKIRTS, TROUSERS, BIB AND BRACE OVERALLS,",FALSE,0,FALSE,,,,TRUE
27084,19392,,6203320,6203,"MENS OR BOYS SUITS, ENSEMBLES, JACKETS, BLAZERS, TROUSERS, BIB AND BRACE OVERALLS, BREECHES AND SHORTS (OTHER THAN SWIM",FALSE,0,FALSE,,,,TRUE
27085,19429,,6204320,6204,"WOMENS OR GIRLS SUITS, ENSEMBLES, JACKETS, BLAZERS, DRESSES, SKIRTS, DIVIDED SKIRTS, TROUSERS, BIB AND BRACE OVERALLS,",FALSE,0,FALSE,,,,TRUE
27086,19452,,6204510,6204,"WOMENS OR GIRLS SUITS, ENSEMBLES, JACKETS, BLAZERS, DRESSES, SKIRTS, DIVIDED SKIRTS, TROUSERS, BIB AND BRACE OVERALLS,",FALSE,0,FALSE,,,,TRUE
27087,19569,,6211320,6211,"TRACK SUITS, SKI SUITS AND SWIMWEAR; OTHER GARMENTS - OTHER GARMENTS, MENS OR BOYS : OF COTTON",FALSE,0,FALSE,,,,TRUE
27088,19667,,6302320,6302,"BED LINEN, TABLE LINEN, TOILET LINEN AND KITCHEN LINEN OTHER BED LINEN: OF MAN-MADE FIBRES",FALSE,0,FALSE,,,,TRUE
27089,19743,,6305320,6305,"SACKS AND BAGS, OF A KIND USED FOR THE PACKING OF GOODS OF MAN-MADE TEXTILE MATERIALS: FLEXIBLE INTERMEDIATE BULK CONTA",FALSE,0,FALSE,,,,TRUE
