id,remote_uid,legacy_id,code,chapter,description,is_service,tax_percentage,is_pre_gst,legacy_metadata,created_at,updated_at,is_active
26088,21529,,7324210,7324,"SANITARY WARE AND PARTS THEREOF, OF IRON OR STEEL - BATHS : OF CAST IRON, WHETHER OR NOT ENAMELLED",FALSE,0,FALSE,,,,TRUE
26089,21530,,7324290,7324,"SANITARY WARE AND PARTS THEREOF, OF IRON OR STEEL - BATHS : OTHER",FALSE,0,FALSE,,,,TRUE
26090,21576,,7403210,7403,"REFINED COPPER AND COPPER ALLOYS, UNWROUGHT - COPPER ALLOYS : COPPER-ZINC BASE ALLOYS (BRASS)",FALSE,0,FALSE,,,,TRUE
26091,21641,,7409210,7409,"COPPER PLATES, SHEETS AND STRIP, OF A THICKNESS EXCEEDING 0.15 MM - OF COPPER-ZINC BASE ALLOYS (BRASS) : IN COILS",FALSE,0,FALSE,,,,TRUE
26092,21650,,7410210,7410,"COPPER FOIL (WHETHER OR NOT PRINTED OR BACKED WITH PAPER, PAPERBOARD, PLASTICS OR SIMILAR BACKING MATERIALS) OF A THICK",FALSE,0,FALSE,,,,TRUE
26093,21654,,7411210,7411,COPPER TUBES AND PIPES - OF COPPER ALLOYS : OF COPPER-ZINC BASE ALLOYS (BRASS),FALSE,0,FALSE,,,,TRUE
26094,21656,,7411290,7411,COPPER TUBES AND PIPES - OF COPPER ALLOYS : OTHER,FALSE,0,FALSE,,,,TRUE
26095,21674,,7415210,7415,"NAILS, TACKS, DRAWING PINS, STAPLES (OTHER THAN THOSE OF HEADING 8305) AND SIMILAR ARTICLES, OF COPPER OR OF IRON OR ST",FALSE,0,FALSE,,,,TRUE
26096,21742,,7505210,7505,"NICKEL BARS, RODS, PROFILES AND WIRE - WIRE : OF NICKEL, NOT ALLOYED",FALSE,0,FALSE,,,,TRUE
26097,21786,,7604210,7604,"ALUMINIUM BARS, RODS AND PROFILES - OF ALUMINIUM ALLOYS : HOLLOW PROFILES",FALSE,0,FALSE,,,,TRUE
26098,21798,,7605210,7605,ALUMINIUM WIRE - OF ALUMINIUM ALLOYS : OF WHICH THE MAXIMUM CROSS-SECTIONAL DIMENSION EXCEEDS 7 MM,FALSE,0,FALSE,,,,TRUE
26099,22090,,8112210,8112,"BERYLLIUM, CHROMIUM, GERMANIUM, VANADIUM, GALLIUM, HAFNIUM, INDIUM, NIOBIUM (COLUMBIUM), RHENIUM AND THALLIUM, AND ARTI",FALSE,0,FALSE,,,,TRUE
26100,22105,,8112990,8112,"BERYLLIUM, CHROMIUM, GERMANIUM, VANADIUM, GALLIUM, HAFNIUM, INDIUM, NIOBIUM (COLUMBIUM), RHENIUM AND THALLIUM, AND ARTI",FALSE,0,FALSE,,,,TRUE
26101,22352,,8407210,8407,SPARK-IGNITION RECIPROCATING OR ROTARY INTERNAL COMBUSTION PISTON ENGINES - MARINE PROPULSION ENGINES: OUTBOARD MOTORS,FALSE,0,FALSE,,,,TRUE
26102,22417,,8411210,8411,"TURBO-JETS, TURBO-PROPELLERS AND OTHER GAS TURBINES - TURBO-PROPELLERS: OF A POWER NOT EXCEEDING 1,100 KW",FALSE,0,FALSE,,,,TRUE
26103,22428,,8411990,8411,"TURBO-JETS, TURBO-PROPELLERS AND OTHER GAS TURBINES - PARTS: OTHER",FALSE,0,FALSE,,,,TRUE
26104,22557,,8418210,8418,"REFRIGERATORS, FREEZERS AND OTHER REFRIGERATING OR FREEZING EQUIPMENT, ELECTRIC OR OTHER; HEAT PUMPS OTHER THAN AIR CON",FALSE,0,FALSE,,,,TRUE
26105,22576,,8418990,8418,"REFRIGERATORS, FREEZERS AND OTHER REFRIGERATING OR FREEZING EQUIPMENT, ELECTRIC OR OTHER; HEAT PUMPS OTHER THAN AIR CON",FALSE,0,FALSE,,,,TRUE
26106,22785,,8432210,8432,"AGRICULTURAL, HORTICULTURAL OR FORESTRY MACHINERY FOR SOIL PREPARATION OR CULTIVATION; LAWN OR SPORTSGROUND ROLLERS - H",FALSE,0,FALSE,,,,TRUE
26107,22925,,8443210,8443,"PRINTING MACHINERY USED FOR PRINTING BY MEANS OF THE PRINTING TYPE, BLOCKS, PLATES, CYLINDERS AND OTHER PRINTING COMPON",FALSE,0,FALSE,,,,TRUE
26108,23118,,8451210,8451,"MACHINERY (OTHER THAN MACHINES OF HEADING 8450) FOR WASHING, CLEANING, WRINGING, DRYING, IRONING, PRESSING (INCLUDING F",FALSE,0,FALSE,,,,TRUE
26109,23237,,8459210,8459,"MACHINE-TOOLS (INCLUDING WAY-TYPE UNIT HEAD MACHINES) FOR DRILLING, BORING, MILLING, THREADING OR TAPPING BY REMOVING M",FALSE,0,FALSE,,,,TRUE
26110,23292,,8460210,8460,"MACHINE-TOOLS FOR DEBURRING, SHARPENING, GRINDING, HONING, LAPPING, POLISHING OR OTHERWISE FINISHING METAL, OR CERMETS",FALSE,0,FALSE,,,,TRUE
26111,23356,,8462210,8462,"MACHINE-TOOLS (INCLUDING PRESSES) FOR WORKING METAL BY FORGING, HAMMERING OR DIE-STAMPING; MACHINE-TOOLS (INCLUDING PRE",FALSE,0,FALSE,,,,TRUE
26112,23471,,8470210,8470,"CALCULATING MACHINES AND POCKET-SIZE DATA RECORDING, REPRODUCING AND DISPLAYING MACHINES WITH CALCULATING FUNCTIONS; AC",FALSE,0,FALSE,,,,TRUE
26113,23529,,8473210,8473,"PARTS AND ACCESSORIES (OTHER THAN COVERS, CARRYING CASES AND THE LIKE) SUITABLE FOR USE SOLELY OR PRINCIPALLY WITH MACH",FALSE,0,FALSE,,,,TRUE
26114,23564,,8475210,8475,"MACHINES FOR ASSEMBLING ELECTRIC OR ELECTRONIC LAMPS, TUBES OR VALVES OR FLASH-BULBS, IN GLASS ENVELOPES; MACHINES OR M",FALSE,0,FALSE,,,,TRUE
26115,23565,,8475290,8475,"MACHINES FOR ASSEMBLING ELECTRIC OR ELECTRONIC LAMPS, TUBES OR VALVES OR FLASH-BULBS, IN GLASS ENVELOPES; MACHINES OR M",FALSE,0,FALSE,,,,TRUE
26116,23678,,8482990,8482,BALL OR ROLLER BEARINGS - PARTS OTHER,FALSE,0,FALSE,,,,TRUE
26117,23796,,8504210,8504,"ELECTRICAL TRANSFORMERS, STATIC CONVERTERS (FOR EXAMPLE, RECTIFIERS) AND INDUCTORS - LIQUID DIELECTRIC TRANSFORMERS: HA",FALSE,0,FALSE,,,,TRUE
26118,23921,,8516210,8516,ELECTRIC INSTANTANEOUS OR STORAGE WATER HEATERS AND IMMERSION HEATERS; ELECTRIC SPACE HEATING APPARATUS AND SOIL HEATIN,FALSE,0,FALSE,,,,TRUE
26119,23952,,8517210,8517,"ELECTRICAL APPARATUS FOR LINE TELEPHONY OR LINE TELEGRAPHY, INCLUDING LINE TELEPHONE SETS WITH CORDLESS HANDSETS AND TE",FALSE,0,FALSE,,,,TRUE
26120,23997,,8518210,8518,"MICROPHONES AND STANDS THEREFOR; LOUDSPEAKERS, WHETHER OR NOT MOUNTED IN THEIR ENCLOSURES; HEADPHONES AND EARPHONES, WH",FALSE,0,FALSE,,,,TRUE
26121,24006,,8519210,8519,"TURNTABLES (RECORD-DECKS), RECORD-PLAYERS, CASSETTE-PLAYERS AND OTHER SOUND REPRODUCING APPARATUS, NOT INCORPORATING A",FALSE,0,FALSE,,,,TRUE
26122,24076,,8523210,8523,"DISCS, TAPES, SOLID-STATE NON-VOLATILE STORAGE DEVICES, SMART CARDS AND OTHER MEDIA FOR THE RECORDING OF SOUND OR OF OT",FALSE,0,FALSE,,,,TRUE
26123,24229,,8527210,8527,"RECEPTION APPARATUS FOR RADIO-BROADCASTING, WHETHER OR NOT COMBINED, IN THE SAME HOUSING, WITH SOUND RECORDING OR REPRO",FALSE,0,FALSE,,,,TRUE
26124,24241,,8527990,8527,OTHER,FALSE,0,FALSE,,,,TRUE
26125,24474,,8540990,8540,"THERMIONIC, COLD CATHODE OR PHOTO-CATHODE VALVES AND TUBES (FOR EXAMPLE, VACUUM OR VAPOUR OR GAS FILLED VALVES AND TUBE",FALSE,0,FALSE,,,,TRUE
26126,24477,,8541210,8541,"DIODES, TRANSISTORS AND SIMILAR SEMI-CONDUCTOR DEVICES; PHOTOSENSITIVE SEMI-CONDUCTOR DEVICES, INCLUDING PHOTOVOLTAIC C",FALSE,0,FALSE,,,,TRUE
26127,24495,,8542210,8542,ELECTRONIC INTEGRATED CIRCUITS AND MICRO-ASSEMBLIES - MONOLITHIC INTEGRATED CIRCUITS: DIGITAL,FALSE,0,FALSE,,,,TRUE
26128,24706,,8606990,8606,"RAILWAY OR TRAMWAY GOODS VANS AND WAGONS, NOT SELF-PROPELLED - OTHER: OTHER",FALSE,0,FALSE,,,,TRUE
26129,24715,,8607210,8607,PARTS OF RAILWAY OR TRAMWAY LOCOMOTIVES OR ROLLING-STOCK - BRAKES AND PARTS THEREOF : AIR BRAKES AND PARTS THEREOF,FALSE,0,FALSE,,,,TRUE
26130,24941,,8708210,8708,PARTS AND ACCESSORIES OF THE MOTOR VEHICLES OF HEADINGS 8701 TO 8705 OTHER PARTS AND ACCESSORIES OF BODIES (INCLUDING C,FALSE,0,FALSE,,,,TRUE
26131,25077,,8805210,8805,AIRCRAFT LAUNCHING GEAR; DECK-ARRESTOR OR SIMILAR GEAR; GROUND FLYING TRAINERS; PARTS OF THE FOREGOING ARTICLES - GROUN,FALSE,0,FALSE,,,,TRUE
26132,25078,,8805290,8805,AIRCRAFT LAUNCHING GEAR; DECK-ARRESTOR OR SIMILAR GEAR; GROUND FLYING TRAINERS; PARTS OF THE FOREGOING ARTICLES - GROUN,FALSE,0,FALSE,,,,TRUE
26133,10115,,72189990,7218,STANLESS STEEL FOIL,FALSE,0,FALSE,,,,TRUE
26134,10205,,69073010,6907,"MOSAIC CUBES AND THE LIKE, OTHER THAN THOSE OF SUB HEADING 690740",FALSE,0,FALSE,,,,TRUE
26135,10207,,84423000,8442,"MACHINERY, APPARATUS AND EQUIPMENT",FALSE,0,FALSE,,,,TRUE
26136,10213,,84133010,8413,"PUMPS FOR LIQUIDS, WHETHER OR NOT FITTED WITH A MEASURING DEVICE; LIQUID ELEVATORS - FUEL, LUBRICATING OR COOLING MEDIUM",FALSE,0,FALSE,,,,TRUE
26137,10227,,96033010,9603,"BROOMS, BRUSHES (INCLUDING BRUSHES CONSTITUTING PARTS OF MACHINES, APPLIANCES OR VEHICLES), HAND-OPERATED MECHANICAL FLO",FALSE,0,FALSE,,,,TRUE
26138,10274,,38123010,3812,"PREPARED RUBBER ACCELERATORS; COMPOUND PLASTICISERS FOR RUBBER OR PLASTICS, NOT ELSEWHERE SPECIFIED OR INCLUDED; ANTI-OX",FALSE,0,FALSE,,,,TRUE
26139,10276,,4203300,4203,"ARTICLES OF APPAREL AND CLOTHING ACCESSORIES, OF LEATHER OR OF COMPOSITION LEATHER - BELTS AND BANDOLIERS",FALSE,0,FALSE,,,,TRUE
26140,10414,,11023000,1102,CEREAL FLOURS OTHER THAN THAT OF WHEAT OR MESLIN RICE FLOUR,FALSE,0,FALSE,,,,TRUE
26141,10434,,11043000,1104,"CEREAL GRAINS OTHERWISE WORKED (FOR EXAMPLE, HULLED, ROLLED, FLAKED, PEARLED, SLICED, OR KIBBLED), EXCEPT RICE OF HEADI",FALSE,0,FALSE,,,,TRUE
26142,10553,,12093000,1209,"SEEDS, FRUIT AND SPORES, OF A KIND USED FOR SOWING SEEDS OF HERBACEOUS PLANTS CULTIVATED PRINCIPALLY FOR THEIR FLOWERS",FALSE,0,FALSE,,,,TRUE
26143,10573,,12113000,1211,"PLANTS AND PARTS OF PLANTS (INCLUDING SEEDS AND FRUITS), OF A KIND USED PRIMARILY IN PERFUMERY, IN PHARMACY OR FOR INSE",FALSE,0,FALSE,,,,TRUE
26144,10706,,13023900,1302,"VEGETABLE SAPS AND EXTRACTS; PECTIC SUBSTANCES, PECTINATES AND PECTATES; AGAR-AGAR AND OTHER MUCILAGES AND THICKENERS,",FALSE,0,FALSE,,,,TRUE
26145,10768,,15043000,1504,"FATS AND OILS AND THEIR FRACTIONS, OF FISH OR MARINE MAMMALS, WHETHER OR NOT REFINED, BUT NOT CHEMICALLY MODIFIED FATS",FALSE,0,FALSE,,,,TRUE
26146,10968,,16053000,1605,"CRUSTACEANS, MOLLUSCS AND OTHER AQUATIC INVERTEBRATES, PREPARED OR PRESERVED LOBSTER",FALSE,0,FALSE,,,,TRUE
26147,11103,,19043000,1904,"PREPARED FOODS OBTAINED BY THE SWELLING OR ROASTING OF CEREALS OR CEREAL PRODUCTS (FOR EXAMPLE, CORN FLAKES); CEREALS [",FALSE,0,FALSE,,,,TRUE
26148,11144,,20059900,2005,"OTHER VEGETABLES PREPARED OR PRESERVED OTHERWISE THAN BY VINEGAR OR ACETIC ACID, NOT FROZEN, OTHER THAN PRODUCTS OF HEA",FALSE,0,FALSE,,,,TRUE
26149,11196,,20093900,2009,"FRUIT JUICES (INCLUDING GRAPE MUST) ANDVEGETABLE JUICES, UNFERMENTED AND NOTCONTAINING ADDED SPIRIT, WHETHER OR NOTCONT",FALSE,0,FALSE,,,,TRUE
26150,11254,,21023000,2102,"YEASTS (ACTIVE OR INACTIVE); OTHER SINGLECELL MICRO - ORGANISMS, DEAD (BUT NOTINCLUDING VACCINES OF HEADING 3002);PREPA",FALSE,0,FALSE,,,,TRUE
26151,11258,,21033000,2103,"SAUCES AND PREPARATIONS THEREFOR, MIXEDCONDIMENTS AND MIXED SEASONINGS;MUSTARD FLOUR AND MEAL AND PREPARED MUSTARD - MU",FALSE,0,FALSE,,,,TRUE
26152,11327,,22043000,2204,OTHER GRAPE MUST,FALSE,0,FALSE,,,,TRUE
26153,11418,,23023000,2302,"BRAN, SHARPS AND OTHER RESIDUES, WHETHEROR NOT IN THE FORM OF PELLETS, DERIVED FROM THE SIFTING, MILLING OR OTHER WORKI",FALSE,0,FALSE,,,,TRUE
26154,11424,,23033000,2303,"RESIDUES OF STARCH MANUFACTURE AND SIMILARRESIDUES, BEET-PULP, BAGASSE AND OTHERWASTE OF SUGAR MANUFACTURE, BREWING ORD",FALSE,0,FALSE,,,,TRUE
26155,11514,,24013000,2401,UNMANUFACTURED TOBACCO; TOBACCO REFUSE - TOBACCO REFUSE,FALSE,0,FALSE,,,,TRUE
26156,11680,,25173000,2517,"PEBBLES, GRAVEL, BROKEN OR CRUSHED STONE, OF A KIND COMMONLY USED FOR CONCRETE AGGREGATES, FOR ROAD METALLING OR FOR RA",FALSE,0,FALSE,,,,TRUE
26157,11686,,25183000,2518,"DOLOMITE, WHETHER OR NOT CALCINED OR SINTERED, INCLUDING DOLOMITE ROUGHLY TRIMMED OR MERELY CUT, BY SAWING OR OTHERWISE",FALSE,0,FALSE,,,,TRUE
26158,11710,,25223000,2522,"QUICKLIME, SLAKED LIME AND HYDRAULIC LIME, OTHER THAN CALCIUM OXIDE AND HYDROXIDE OF HEADING 2825 HYDRAULIC LIME",FALSE,0,FALSE,,,,TRUE
26159,11719,,25233000,2523,"PORTLAND CEMENT, ALUMINOUS CEMENT, SLAG CEMENT, SUPERSULPHATE CEMENT AND SIMILAR HYDRAULIC CEMENTS, WHETHER OR NOT COLO",FALSE,0,FALSE,,,,TRUE
26160,11794,,25293000,2529,FELDSPAR; LEUCITE; NEPHELINE AND NEPHELINE SYENITE; FLUORSPAR - LEUCITE; NEPHELINE AND NEPHELINE SYENITE,FALSE,0,FALSE,,,,TRUE
26161,11950,,27073000,2707,OILS AND OTHER PRODUCTS OF THE DISTILLATION OF HIGH TEMPERATURE COAL TAR SIMILAR PRODUCTS IN WHICH THE WEIGHT OF THE AR,FALSE,0,FALSE,,,,TRUE
26162,11955,,27079900,2707,OILS AND OTHER PRODUCTS OF THE DISTILLATION OF HIGH TEMPERATURE COAL TAR SIMILAR PRODUCTS IN WHICH THE WEIGHT OF THE AR,FALSE,0,FALSE,,,,TRUE
26163,12104,,28043000,2804,"HYDROGEN, RARE GASES AND OTHER NON-METALS - NITROGEN",FALSE,0,FALSE,,,,TRUE
26164,12122,,28053000,2805,"ALKALI OR ALKALINE-EARTH METALS; RARE-EARTH METALS, SCANDIUM AND YTTRIUM, WHETHER OR NOT INTERMIXED OR INTERALLOYED; ME",FALSE,0,FALSE,,,,TRUE
26165,12202,,28153000,2815,SODIUM HYDROXIDE (CAUSTIC SODA); POTASSIUM HYDROXIDE (CAUSTIC POTASH); PEROXIDES OF SODIUM OR POTASSIUM - PEROXIDES OF,FALSE,0,FALSE,,,,TRUE
26166,12216,,28183000,2818,"ARTIFICIAL CORUNDUM, WHETHER OR NOT CHEMICALLY DEFINED; ALUMINIUM OXIDE; ALUMINIUM HYDROXIDE -ALUMINIUM HYDROXIDE",FALSE,0,FALSE,,,,TRUE
26167,12278,,28263000,2826,"FLUORIDES; FLUOROSILICATES, FLUOROALUMINATES AND OTHER COMPLEX FLUORINE SALTS -SODIUM HEXAFLUOROALUMINATE (SYNTHETIC CR",FALSE,0,FALSE,,,,TRUE
26168,12333,,28303000,2830,"SULPHIDES; POLYSULPHIDES, WHETHER OR NOT CHEMICALLY DEFINED - CADMIUM SULPHIDE",FALSE,0,FALSE,,,,TRUE
26169,12415,,28363000,2836,CARBONATES; PEROXOCARBONATES (PERCARBONATES); COMMERCIAL AMMONIUM CARBONATE CONTAINING AMMONIUM CARBAMATE SODIUM HYDROG,FALSE,0,FALSE,,,,TRUE
26170,12457,,28403000,2840,BORATES; PEROXOBORATES (PERBORATES) PEROXOBORATES (PERBORATES),FALSE,0,FALSE,,,,TRUE
26171,12463,,28413000,2841,SALTS OF OXOMETALLIC OR PEROXOMETALLIC ACIDS SODIUM DICHROMATE,FALSE,0,FALSE,,,,TRUE
26172,12488,,28433000,2843,"COLLOIDAL PRECIOUS METALS; INORGANIC OR ORGANIC COMPOUNDS OF PRECIOUS METALS, WHETHER OR NOT CHEMICALLY DEFINED; AMALGA",FALSE,0,FALSE,,,,TRUE
26173,12583,,2902300,2902,CYCLIC HYDROCARBONS -TOLUENE,FALSE,0,FALSE,,,,TRUE
26174,12875,,2910300,2910,"EPOXIDES, EPOXYALCOHOLS, EPOXYPHENOLS AND EXPOXYETHERS, WITH A THREE-MEMBERED RING, AND THEIR HALOGENATED, SULPHONATED,",FALSE,0,FALSE,,,,TRUE
26175,13195,,2920300,2920,ENDOSULFAN (ISO),FALSE,0,FALSE,,,,TRUE
26176,13361,,2922390,2922,"OXYGEN-FUNCTION AMINO-COMPOUNDS - AMINO-ALDEHYDES , AMINO-KETONES AND AMINOQUINONES, OTHER THAN THOSE CONTAINING MORE T",FALSE,0,FALSE,,,,TRUE
26177,13388,,2923300,2923,TETRAETHYLAMMONIUM PERFLUOROOCTANE SULPHONATE,FALSE,0,FALSE,,,,TRUE
26178,13425,,2926300,2926,NITRILE-FUNCTION COMPOUNDS FENPROPOREX (INN) AND ITS SALTS,FALSE,0,FALSE,,,,TRUE
26179,13449,,2930300,2930,"ORGANO-SULPHUR COMPOUNDS - THIURAM MONO-, DI OR TETRASULPHIDES",FALSE,0,FALSE,,,,TRUE
26180,13527,,2932990,2932,HETEROCYCLIC COMPOUNDS WITH OXYGEN HETERO-ATOM (S) ONLY - OTHER : OTHER,FALSE,0,FALSE,,,,TRUE
26181,13603,,2934300,2934,NUCLEIC ACIDS AND THEIR SALTS; WHETHER OR NOT CHEMICALLY DEFINED; OTHER HETEROCYCLIC COMPOUNDS COMPOUNDS CONTAINING IN,FALSE,0,FALSE,,,,TRUE
26182,13606,,2934990,2934,NUCLEIC ACIDS AND THEIR SALTS; WHETHER OR NOT CHEMICALLY DEFINED; OTHER HETEROCYCLIC COMPOUNDS - OTHER : OTHER,FALSE,0,FALSE,,,,TRUE
26183,13624,,2935300,2935,N-ETHYL-N-(2-HYDROXYETHYL) PERFLUOROOCTANE SULPHONAMIDE,FALSE,0,FALSE,,,,TRUE
26184,13697,,2939300,2939,"VEGETABLE ALKALOIDS, NATURAL OR REPRODUCED BY SYNTHESIS, AND THEIR SALTS, ETHERS, ESTERS AND OTHER DERIVATIVES - CAFFEI",FALSE,0,FALSE,,,,TRUE
26185,13825,,3002300,3002,"HUMAN BLOOD; ANIMAL BLOOD PREPARED FOR THERAPEUTIC, PROPHYLACTIC OR DIAGNOSTIC USES; ANTISERA AND OTHER BLOOD FRACTIONS",FALSE,0,FALSE,,,,TRUE
26186,13835,,3003390,3003,"MEDICAMENTS (EXCLUDING GOODS OF HEADING 3002, 3005 OR 3006) CONSISTING OF TWO OR MORE CONSTITUENTS WHICH HAVE BEEN MIXE",FALSE,0,FALSE,,,,TRUE
26187,14034,,3006300,3006,PHARMACEUTICAL GOODS SPECIFIED IN NOTE 4 TO THIS CHAPTER OPACIFYING PREPRATIONS FOR X-RAY EXAMINATIONS; DIAGNOSTIC REAG,FALSE,0,FALSE,,,,TRUE
26188,14101,,3102300,3102,"MINERAL OR CHEMICAL FERTILISERS, NITROGENOUS AMMONIUM NITRATE, WHETHER OR NOT IN AQUEOUS SOLUTION",FALSE,0,FALSE,,,,TRUE
26189,14119,,3104300,3104,"MINERAL OR CHEMICAL FERTILISERS, POTASSIC POTASSIUM SULPHATE",FALSE,0,FALSE,,,,TRUE
26190,14124,,3105300,3105,"MINERAL OR CHEMICAL FERTILISERSCONTAINING TWO OR THREE OF THE FERTILISING ELEMENTS NITROGEN,PHOSPHORUS AND POTASSIUM; O",FALSE,0,FALSE,,,,TRUE
26191,14413,,3206300,3206,"OTHER COLOURING MATTER; PREPARATIONS AS SPECIFIED IN NOTE 3 TO THIS CHAPTER, OTHER THAN THOSE OF HEADINGS 3203, 3204 OR",FALSE,0,FALSE,,,,TRUE
26192,14434,,3207300,3207,"PREPARED PIGMENTS, PREPARED OPACIFIERS AND PREPARED COLOURS, VITRIFIABLE ENAMELS AND GLAZES, ENGOBES (SLIPS), LIQUID LU",FALSE,0,FALSE,,,,TRUE
26193,14616,,3304300,3304,"BEAUTY OR MAKE-UP PREPARATIONS AND PREPARATIONS FOR THE CARE OF THE SKIN (OTHER THAN MEDICAMENTS), INCLUDING SUNSCREEN",FALSE,0,FALSE,,,,TRUE
26194,14633,,3305300,3305,PREPARATIONS FOR USE ON THE HAIR HAIR LACQUERS,FALSE,0,FALSE,,,,TRUE
26195,14723,,3405300,3405,"POLISHES AND CREAMS, FOR FOOTWEAR, FURNITURE, FLOORS, COACHWORK, GLASS OR METAL, SCOURING PASTES AND POWDERS AND SIMILA",FALSE,0,FALSE,,,,TRUE
26196,14827,,3701300,3701,"PHOTOGRAPHIC PLATES AND FILM IN THE FLAT, SENSITISED, UNEXPOSED, OF ANY MATERIAL OTHER THAN PAPER, PAPERBOARD OR TEXTIL",FALSE,0,FALSE,,,,TRUE
26197,14965,,3801300,3801,ARTIFICIAL GRAPHITE; COLLOIDAL OR SEMI-COLLOIDAL GRAPHITE; PREPARATIONS BASED ON GRAPHITE OR OTHER CARBON IN THE FORM O,FALSE,0,FALSE,,,,TRUE
26198,14997,,3806300,3806,"ROSIN AND RESIN ACIDS, AND DERIVATIVES THEREOF; ROSIN SPIRIT AND ROSIN OILS; RUN GUMS ESTER GUMS",FALSE,0,FALSE,,,,TRUE
26199,15188,,3824300,3824,PREPARED BINDERS FOR FOUNDRY MOULDS OR CORES; CHEMICAL PRODUCTS AND PREPARATIONS OF THE CHEMICAL OR ALLIED INDUSTRIES (,FALSE,0,FALSE,,,,TRUE
26200,15247,,3825300,3825,"RESIDUAL PRODUCTS OF THE CHEMICAL OR ALLIED INDUSTRIES, NOT ELSEWHERE SPECIFIED OR INCLUDED; MUNICIPAL WASTE; SEWAGE SL",FALSE,0,FALSE,,,,TRUE
26201,15263,,3901300,3901,"POLYMERS OF ETHYLENE, IN PRIMARY FORMS ETHYLENE - VINYL ACETATE COPOLYMERS",FALSE,0,FALSE,,,,TRUE
26202,15274,,3902300,3902,"POLYMERS OF PROPYLENE OR OF OTHER OLEFINS, IN PRIMARY FORMS PROPYLENE COPOLYMERS",FALSE,0,FALSE,,,,TRUE
26203,15282,,3903300,3903,"POLYMERS OF STYRENE, IN PRIMARY FORMS - ACRYLONITRILE - BUTADINE - STYRENE (ABS) COPOLYMERS",FALSE,0,FALSE,,,,TRUE
26204,15324,,3905300,3905,"POLYMERS OF VINYL ACETATE OR OF OTHER VINYL ESTERS, IN PRIMARY FORMS; OTHER VINYL POLYMERS IN PRIMARY FORMS - POLY (VIN",FALSE,0,FALSE,,,,TRUE
26205,15748,,3925300,3925,"BUILDERS WARE OF PLASTICS, NOT ELSEWHERE SPECIFIED OR INCLUDED - SHUTTERS, BLINDS (INCLUDING VENETIAN BLINDS) AND SIMIL",FALSE,0,FALSE,,,,TRUE
26206,15814,,4001300,4001,"NATURAL RUBBER, BALATA, GUTTA-PERCHA, GUAYULE, CHICLE AND SIMILAR NATURAL GUMS, IN PRIMARY FORMS OR IN PLATES, SHEETS O",FALSE,0,FALSE,,,,TRUE
26207,15824,,4002390,4002,"SYNTHETIC RUBBER AND FACTICE DERIVED FROM OILS, IN PRIMARY FORMS OR IN PLATES, SHEETS OR STRIP; MIXTURES OF ANY PRODUCT",FALSE,0,FALSE,,,,TRUE
26208,15934,,4011300,4011,"NEW PNEUMATIC TYRES, OF RUBBER OF A KIND USED ON AIRCRAFT",FALSE,0,FALSE,,,,TRUE
26209,16080,,4103300,4103,"OTHER RAW HIDES AND SKINS (FRESH, OR SALTED, DRIED, LIMED, PICKLED OR OTHERWISE PRESERVED, BUT NOT TANNED, PARCHMENT-DR",FALSE,0,FALSE,,,,TRUE
26210,16089,,4105300,4105,"TANNED OR CRUST SKINS OF SHEEP OR LAMBS, WITHOUT WOOL ON, WHETHER OR NOT SPLIT, BUT NOT FURTHER PREPARED - IN THE DRY S",FALSE,0,FALSE,,,,TRUE
26211,16104,,4107990,4107,"LEATHER FURTHER PREPARED AFTER TANNING OR CRUSTING, INCLUDING PARCHMENT-DRESSED LEATHER, OF BOVINE (INCLUDING BUFFALO)",FALSE,0,FALSE,,,,TRUE
26212,16110,,4113300,4113,"LEATHER FURTHER PREPARED AFTER TANNING OR CRUSTING, INCLUDING PARCHMENT-DRESSED LEATHER, OF OTHER ANIMALS, WITHOUT WOOL",FALSE,0,FALSE,,,,TRUE
26213,16212,,4301300,4301,"RAW FURSKINS (INCLUDING HEADS, TAILS, PAWS AND OTHER PIECES OR CUTTINGS, SUITABLE FOR FURRIERS USE), OTHER THAN RAW HID",FALSE,0,FALSE,,,,TRUE
26214,16227,,4302300,4302,"TANNED OR DRESSED FURSKINS (INCLUDING HEADS, TAILS, PAWS AND OTHER PIECES OR CUTTINGS), UNASSEMBLED, OR ASSEMBLED (WITH",FALSE,0,FALSE,,,,TRUE
26215,16597,,4418300,4418,"BUILDERR JOINERY AND CARPENTRY OF WOOD, INCLUDING CELLULAR WOOD PANELS, ASSEMBLED PARQUET PANELS, SHINGLES AND SHAKES -",FALSE,0,FALSE,,,,TRUE
26216,16697,,4601990,4601,"PLAITS AND SIMILAR PRODUCTS OF PLAITING MATERIALS, WHETHER OR NOT ASSEMBLED INTO STRIPS ; PLAITING MATERIALS, PLAITS AN",FALSE,0,FALSE,,,,TRUE
26217,16728,,4706300,4706,PULPS OF FIBRES DERIVED FROM RECOVERED (WASTE AND SCRAP) PAPER OR PAPERBOARD OR OF OTHER FIBROUS CELLULOSIC MATERIAL -,FALSE,0,FALSE,,,,TRUE
26218,16736,,4707300,4707,"RECOVERED (WASTE AND SCRAP) PAPER OR PAPERBOARD - PAPER OR PAPERBOARD MADE MAINLY OF MECHANICAL PULP (FOR EXAMPLE, NEWS",FALSE,0,FALSE,,,,TRUE
26219,16749,,4802300,4802,"UNCOATED PAPER AND PAPERBOARD, OF A KIND USED FOR WRITING, PRINTING OR OTHER GRAPHIC PURPOSES, AND NON-PERFORATED PUNCH",FALSE,0,FALSE,,,,TRUE
26220,16838,,4805300,4805,"OTHER UNCOATED PAPER AND PAPERBOARD, IN ROLLS OR SHEETS, NOT FURTHER WORKED OR PROCESSED THAN AS SPECIFIED IN NOTE 3 TO",FALSE,0,FALSE,,,,TRUE
26221,16847,,4806300,4806,"VEGETABLE PARCHMENT, GREASEPROOF PAPERS, TRACING PAPERS AND GLASSINE AND OTHER GLAZED TRANSPARENT OR TRANSLUCENT PAPERS",FALSE,0,FALSE,,,,TRUE
26222,16927,,4814300,4814,"WALLPAPER AND SIMILAR WALL COVERINGS; WINDOW TRANSPARENCIES OF PAPER - WALLPAPER AND SIMILAR WALL COVERINGS, CONSISTING",FALSE,0,FALSE,,,,TRUE
26223,16937,,4816300,4816,"CARBON-PAPER, SELF-COPY PAPER AND OTHER COPYING OR TRANSFER PAPERS (OTHER THAN THOSE OF HEADING 4809), DUPLICATOR STENC",FALSE,0,FALSE,,,,TRUE
26224,16951,,4818300,4818,"TOILET PAPER AND SIMILAR PAPER, CELLULOSE WADDING OR WEBS OF CELLULOSE FIBRES, OF A KIND USED FOR HOUSEHOLD OR SANITARY",FALSE,0,FALSE,,,,TRUE
26225,16963,,4819300,4819,"CARTONS, BOXES, CASES, BAGS AND OTHER PACKING CONTAINERS, OF PAPER, PAPERBOARD, CELLULOSE WADDING OR WEBS OF CELLULOSE",FALSE,0,FALSE,,,,TRUE
26226,16974,,4820300,4820,"REGISTERS, ACCOUNT BOOKS, NOTE BOOKS, ORDER BOOKS, RECEIPT BOOKS, LETTER PADS, MEMORANDUM PADS, DIARIES AND SIMILAR ART",FALSE,0,FALSE,,,,TRUE
26227,17155,,5101300,5101,"WOOL, NOT CARDED OR COMBED : CARBONISED",FALSE,0,FALSE,,,,TRUE
26228,17174,,5103300,5103,"WASTE OF WOOL OR OF FINE OR COARSE ANIMAL HAIR, INCLUDING YARN WASTE BUT EXCLUDING GARNETTED STOCK WASTE OF COARSE ANIM",FALSE,0,FALSE,,,,TRUE
26229,17308,,5202990,5202,COTTON WASTE (INCLUDING YARN WASTE AND GARNETTED STOCK) OTHER :OTHER,FALSE,0,FALSE,,,,TRUE
26230,17854,,5301300,5301,"FLAX, RAW OR PROCESSED BUT NOT SPUN; FLAX TOW AND WASTE (INCLUDING YARN WASTE AND GARNETTED STOCK) FLAX TOW AND WASTE",FALSE,0,FALSE,,,,TRUE
26231,18253,,5501300,5501,SYNTHETIC FILAMENT TOW - ACRYLIC OR MODACRYLIC,FALSE,0,FALSE,,,,TRUE
26232,18274,,5503300,5503,"SYNTHETIC STAPLE FIBRES, NOT CARDED, COMBED OR OTHERWISE PROCESSED FOR SPINNING - ACRYLIC OR MODACRYLIC",FALSE,0,FALSE,,,,TRUE
26233,18299,,5506300,5506,"SYNTHETIC STAPLE FIBRES, CARDED COMBED OR OTHERWISE PROCESSED FOR SPINNING - ACRYLIC OR MODACRYLIC",FALSE,0,FALSE,,,,TRUE
26234,18410,,5513390,5513,"WOVEN FABRICS OF SYNTHETIC STAPLE FIBRES, CONTAINING LESS THAN 85% BY WEIGHT OF SUCH FIBRES, MIXED MAINLY OR SOLELY WIT",FALSE,0,FALSE,,,,TRUE
26235,18439,,5514390,5514,"WOVEN FABRICS OF SYNTHETIC STAPLE FIBRES, CONTAINING LESS THAN 85% BY WEIGHT OF SUCH FIBRES, MIXED MAINLY OR SOLELY WIT",FALSE,0,FALSE,,,,TRUE
26236,18545,,5601300,5601,"WADDING OF TEXTILE MATERIALS AND ARTICLES THEREOF; TEXTILE FIBRES, NOT EXCEEDING 5 MM IN LENGTH (FLOCK), TEXTILE DUST A",FALSE,0,FALSE,,,,TRUE
26237,18585,,5607300,5607,"TWINE, CORDAGE, ROPES AND CABLES, WHETHER OR NOT PLAITED OR BRAIDED AND WHETHER OR NOT IMPREGNATED, COATED, COVERED OR",FALSE,0,FALSE,,,,TRUE
26238,18772,,5802300,5802,"TERRY TOWELLING AND SIMILAR WOVEN TERRY FABRICS, OTHER THAN NARROW FABRICS OF HEADING 5806; TUFTED TEXTILE FABRICS, OTH",FALSE,0,FALSE,,,,TRUE
26239,18803,,5804300,5804,"TULLES AND OTHER NET FABRICS, NOT INCLUDING WOVEN, KNITTED OR CROCHETED FABRICS; LACE IN THE PIECE, IN STRIPS OR IN MOT",FALSE,0,FALSE,,,,TRUE
26240,18853,,5810990,5810,"EMBROIDERY IN THE PIECE, IN STRIPS OR IN MOTIFS - OTHER EMBROIDERY: OF OTHER TEXTILE MATERIALS",FALSE,0,FALSE,,,,TRUE
26241,18980,,6003300,6003,"KNITTED OR CROCHETED FABRICS OF A WIDTH NOT EXCEEDING 30 CM, OTHER THAN THOSE OF HEADING 6001 OR 6002 - OF SYNTHETIC FI",FALSE,0,FALSE,,,,TRUE
26242,19243,,6111300,6111,"BABIES GARMENTS AND CLOTHING ACCESSORIES, KNITTED OR CROCHETED - OF SYNTHETIC FIBRES",FALSE,0,FALSE,,,,TRUE
26243,19299,,6115300,6115,OTHER WOMENS FULL OR KNEE LENGHT HOSIERY,FALSE,0,FALSE,,,,TRUE
26244,19476,,6205300,6205,MENS OR BOYS SHIRTS - OF MAN-MADE FIBRES,FALSE,0,FALSE,,,,TRUE
26245,19488,,6206300,6206,"WOMENS OR GIRLS BLOUSES, SHIRTS AND SHIRT-BLOUSES - OF COTTON",FALSE,0,FALSE,,,,TRUE
26246,19546,,6209300,6209,BABIES GARMENTS AND CLOTHING ACCESSORIES - OF SYNTHETIC FIBRES,FALSE,0,FALSE,,,,TRUE
26247,19587,,6212300,6212,"BRASSIERES, GIRDLES, CORSETS, BRACES, SUSPENDERS, GARTERS AND SIMILAR ARTICLES AND PARTS THEREOF, WHETHER OR NOT KNITTE",FALSE,0,FALSE,,,,TRUE
26248,19608,,6214300,6214,"SHAWLS, SCARVES, MUFFLERS, MANTILLAS, VEILS AND THE LIKE - OF SYNTHETIC FIBRES",FALSE,0,FALSE,,,,TRUE
26249,19652,,6301300,6301,"BLANKETS AND TRAVELLING RUGS BLANKETS (OTHER THAN ELECTRIC BLANKETS) AND TRAVELLING RUGS, OF COTTON",FALSE,0,FALSE,,,,TRUE
26250,19758,,6306300,6306,SAILS,FALSE,0,FALSE,,,,TRUE
26251,19844,,6403300,6403,"FOOTWEAR WITH OUTER SOLES OF RUBBER, PLASTICS, LEATHER OR COMPOSITION LEATHER AND UPPERS OF LEATHER FOOTWEAR MADE ON A",FALSE,0,FALSE,,,,TRUE
26252,19920,,6506990,6506,"OTHER HEADGEAR, WHETHER OR NOT LINED OR TRIMMED OTHER:OF OTHER MATERIALS",FALSE,0,FALSE,,,,TRUE
26253,19926,,6601990,6601,"UMBRELLAS AND SUN UMBRELLAS (INCLUDING WALKINGSTICK UMBRELLAS, GARDEN UMBRELLAS AND SIMILAR UMBRELLAS)- OTHER: OTHER",FALSE,0,FALSE,,,,TRUE
26254,19978,,6802990,6802,"WORKED MONUMENTAL OR BUILDING STONE (EXCEPT SLATE) AND ARTICLES THEREOF, OTHER THAN GOODS OF HEADING 6801; MOSAIC CUBES",FALSE,0,FALSE,,,,TRUE
26255,20504,,7112300,7112,WASTE AND SCRAP OF PRECIOUS METAL OR OF METAL CLAD WITH PRECIOUS METAL; OTHER WASTE AND SCRAP CONTAINING PRECIOUS METAL,FALSE,0,FALSE,,,,TRUE
26256,20577,,7202300,7202,FERRO-ALLOYS - FERRO-SILICO-MANGANESE,FALSE,0,FALSE,,,,TRUE
26257,20611,,7204300,7204,FERROUS WASTE AND SCRAP; REMELTING SCRAP INGOTS OF IRON OR STEEL - WASTE AND SCRAP OF TINNED IRON OR STEEL,FALSE,0,FALSE,,,,TRUE
