sr_no,name,brand,mpn,sku,quantity,tax_code,tax_rate,is_service,category_id
1,HONEYWELL A700 GREY FRAME TSR - 1015351,HONEYWELL,1015351,,1,90044901,18,no,3049
2,HONEYWELL A700 CLEAR FRAME AF - 1015360,HONEYWELL,1015360,,1,90044901,18,no,3049
3,HONEYWELL A700 CLEAR FRAME HC  BULK - 1015361,HONEYWELL,1015361,,1,90044901,18,no,3049
4,HONEYWELL A700 GREY FRAME TSR GREY HC - 1015362,HONEYWELL,1015362,,1,90044901,18,no,3049
5,HONEYWELL A700 CLEAR FRAME AMB TEMPLES AMB HC LENS - 1015441,HONEYWELL,1015441,,1,90044901,18,no,3049
6,HONEYWELL A800 GREY TEMPLES/ I/O SILVER LENS HC - 1015350,HONEYWELL,1015350,,1,40155110,18,no,3049
7,HONEYWELL A800 GREY TEMPLES/TSR GREY LENS FOGBAN - 1015367,HONEYWELL,1015367,,1,90044901,18,no,3049
8,HONEYWELL A800 CLEAR TEMPLES/CLEAR LENS FOGBAN - 1015369,HONEYWELL,1015369,,1,90044901,18,no,3049
9,HONEYWELL A800 GREY TEMPLES/TSR GREY LENS HC - 1015368-H6,HONEYWELL,1015368-H6,,1,90044901,18,no,3049
10,HONEYWELL A800 CLEAR TEMPLES/CLEAR LENS HC - 1015370-H6,HONEYWELL,1015370-H6,,1,90044901,18,no,3049
11,HONEYWELL ADAPTEC N BLUE/GREY CLEAR 4A+ - 1030740,HONEYWELL,1030740,,1,90044901,18,no,3049
12,HONEYWELL ADAPTEC R BLACK/RED CLEAR 4A+ - 1030749,HONEYWELL,1030749,,1,90044901,18,no,3049
13,HONEYWELL HW ADAPTEC BLUE/GREY CLR 4A(10Each) - 1030750,HONEYWELL,1030750,,1,90044901,18,no,3049
14,HONEYWELL SPERIAN ADAPTEC BLACK/RED I/O 4A+(10EA) - 1030751,HONEYWELL,1030751,,1,90044901,18,no,3049
15,HONEYWELL WIDE BL FRAME CLEAR LENS - 1030760,HONEYWELL,1030760,,1,90044901,18,no,3049
16,HONEYWELL HONEYWELL ADAPTEC BLACK/RED CLR 4A(10EA) - 1030749-H5,HONEYWELL,1030749-H5,,1,90044901,18,no,3049
17,HONEYWELL HW ADAPTEC REG BK FR CLR HS - 1030749HS,HONEYWELL,1030749HS,,1,90044901,18,no,3049
18,HONEYWELL Honeywell Avatar Black / HydroShield coating/ Clear lens - 1034831,HONEYWELL,1034831,,1,90044901,18,no,3049
19,HONEYWELL Honeywell Avatar Black / HydroShield coating/ Grey lens - 1034832,HONEYWELL,1034832,,1,90044901,18,no,3049
20,HONEYWELL Honeywell Avatar Black / HydroShield coating/ Amber lens - 1034833,HONEYWELL,1034833,,1,90044901,18,no,3049
21,HONEYWELL Honeywell Avatar Black / Hard Coating/ I/O lens I/O Hard Coat - 1034834,HONEYWELL,1034834,,1,90044901,18,no,3049
22,HONEYWELL Honeywell Avatar Black / Hard Coating/ Blue mirror lens - 1034835,HONEYWELL,1034835,,1,90044901,18,no,3049
23,HONEYWELL Honeywell Avatar Black&Red / HydroShield coating/ Clear lens - 1034836,HONEYWELL,1034836,,1,90044901,18,no,3049
24,HONEYWELL Honeywell Avatar Black&Red / HydroShield coating/ Grey lens - 1034837,HONEYWELL,1034837,,1,90044901,18,no,3049
25,HONEYWELL Honeywell Avatar Black&Red / Hard Coating/ I/O lens - 1034838,HONEYWELL,1034838,,1,90044901,18,no,3049
26,"HONEYWELL TRIMRING,BLACK,TR-3-G - 18447",HONEYWELL,18447,,1,90044902,12,no,3049
27,"HONEYWELL SHEET METAL,CHASSIS,RM-1 - 18448",HONEYWELL,18448,,1,90044903,12,no,3049
28,HONEYWELL SPERIAN SW06E - 18893,HONEYWELL,18893,,1,90044904,12,no,3049
29,"HONEYWELL SHT MTL,BRACKET,AUDIOSUP-MB-PCA - 18934",HONEYWELL,18934,,1,90044905,12,no,3049
30,HONEYWELL SW07 T GML 6013 127 INST/STRP - 18940,HONEYWELL,18940,,1,90044906,12,no,3049
31,HONEYWELL PROTEGE BLACK TSR-GRAY HSAF - 1015353HS,HONEYWELL,1015353HS,,1,90044901,18,no,3049
32,HONEYWELL PROTEGE BLACK CLEAR HSAF - 1015364HS,HONEYWELL,1015364HS,,1,90044901,18,no,3049
33,HONEYWELL PROTEGE BLACK HDL-YELLOW HSAF - 1016342HS,HONEYWELL,1016342HS,,1,90044901,18,no,3049
34,HONEYWELL The  Over The Glass  Spectacle - Pc Lens - 906500,HONEYWELL,906500,,1,90044901,18,no,3049
35,HONEYWELL T2400 TACTILE CLEAR 3A - 908730,HONEYWELL,908730,,1,90044901,18,no,3049
36,"HONEYWELL 90S VISITOR, PC, TRP FRAME - 909110",HONEYWELL,909110,,1,90044901,18,no,3049
37,"HONEYWELL OPTEMA, BLACK FRAME, CLEAR LENS - 1000016",HONEYWELL,1000016,,1,90044901,18,no,3049
38,HONEYWELL MILLENNIA BLACK FRAME CLEAR FOGBAN PLUS - 1002781,HONEYWELL,1002781,,1,90044901,18,no,3049
39,"HONEYWELL OPTEMA, BLUE FRAME, CLEAR ANTI-FOG LENS - 1004949",HONEYWELL,1004949,,1,90044901,18,no,3049
40,HONEYWELL SP1000 2G CLEAR DURASTREME - 1028640,HONEYWELL,1028640,,1,90044901,18,no,3049
41,HONEYWELL Clear Fog Ban Plus INSTINCT - 1031540,HONEYWELL,1031540,,1,90044901,18,no,3049
42,HONEYWELL MILLENNIA 2G BLACK FRAME CLEAR FOGBAN - 1032179,HONEYWELL,1032179,,1,90044901,18,no,3049
43,HONEYWELL AL-1302T1 VISITOR'S OVER SPECTACLE - AL-1302T1-AF,HONEYWELL,AL-1302T1-AF,,1,90044901,18,no,3049
44,HONEYWELL AL-1951 ADJUSTABLE SPECTACLE - AL-1951-HC,HONEYWELL,AL-1951-HC,,1,90044901,18,no,3049
45,HONEYWELL AL-2016 LIGHTWEIGHT NYLON FRAME SPECTACL - AL-2016-HC,HONEYWELL,AL-2016-HC,,1,90044901,18,no,3049
46,HONEYWELL AL-9227 LIGHTEST SAFETY SPECTACLE - AL-9227-HC,HONEYWELL,AL-9227-HC,,1,90044901,18,no,3049
47,HONEYWELL KINGS SAFETY SPECTACLE-CLEAR - KY2221,HONEYWELL,KY2221,,1,90044901,18,no,3049
48,HONEYWELL Protective Spectacle Smoke Temple/Smoke - KY2222,HONEYWELL,KY2222,,1,90044901,18,no,3049
49,HONEYWELL SPERIAN MILLENNIA Welding&IR3Lens (10EA) - 1006405,HONEYWELL,1006405,,1,90044901,18,no,3049
50,HONEYWELL SPERIAN MILLENNIA Welding&IR5Lens (10EA) - 1006406,HONEYWELL,1006406,,1,90044901,18,no,3049
51,HONEYWELL HONEYWELL XC SHD 4 - 1012901,HONEYWELL,1012901,,1,90044901,18,no,3049
52,HONEYWELL DURAMAXX SHD3 DURA NEOPR - 1028133,HONEYWELL,1028133,,1,90044901,18,no,3049
53,HONEYWELL MILLENIA 2G (WELDING) - 1032182,HONEYWELL,1032182,,1,90044901,18,no,3049
54,HONEYWELL SPERIAN XC Clear Fog-Ban lens (10EA) - 1011015,HONEYWELL,1011015,,1,90044901,18,no,3049
55,HONEYWELL HONEYWELL XC BLUE AMB HC - 1011024,HONEYWELL,1011024,,1,90044901,18,no,3049
56,HONEYWELL HONEYWELL XC BLUE GRAY HSAF - 1011025HS,HONEYWELL,1011025HS,,1,90044901,18,no,3049
57,HONEYWELL HONEYWELL XC BLUE CLEAR HSAF - 1011027HS,HONEYWELL,1011027HS,,1,90044901,18,no,3049
58,HONEYWELL HONEYWELL XC AMBER HSAF - 1012900HS,HONEYWELL,1012900HS,,1,90044901,18,no,3049
59,HONEYWELL XVSERIES CLEAR HC - 1028860,HONEYWELL,1028860,,1,90044901,18,no,3049
60,HONEYWELL XVSERIES CLEAR FB - 1028862,HONEYWELL,1028862,,1,90044901,18,no,3049
61,HONEYWELL GRAY FRAME GRAY HC - 1029692,HONEYWELL,1029692,,1,90044901,18,no,3049
62,HONEYWELL LG 10 GOGGLE CLR LNS UNCOATED/PULSAFE - 1005504,HONEYWELL,1005504,,1,90044901,18,no,3049
63,HONEYWELL LG 20 GOGGLE CLR LNS UNCOATED/PULSAFE - 1005507,HONEYWELL,1005507,,1,90044901,18,no,3049
64,HONEYWELL LG 20 GOGGLE CLR LNS ANTIFOG/PULSAFE - 1005509,HONEYWELL,1005509,,1,90044901,18,no,3049
65,HONEYWELL V-MAXX INDIRECT VENT CLEAR LENS - 1006192,HONEYWELL,1006192,,1,90044901,18,no,3049
66,HONEYWELL V-MAXX INDIRECT VENT CLR FOGBAN LNS - 1006193,HONEYWELL,1006193,,1,90044901,18,no,3049
67,HONEYWELL V-MAXX IND VENT CLR FB LNS NEOPRENE STP - 1006194,HONEYWELL,1006194,,1,90044901,18,no,3049
68,HONEYWELL V-MAXX GOGGLE CHEMISTRY - 1007506,HONEYWELL,1007506,,1,90044901,18,no,3049
69,HONEYWELL V-MAXX WELDING IR SHADE 5.0 - 1008111,HONEYWELL,1008111,,1,90044901,18,no,3049
70,HONEYWELL HW MAXX-PRO GOGGLE CLEAR FB LNS - 1011071,HONEYWELL,1011071,,1,90044901,18,no,3049
71,HONEYWELL HW MAXX PRO FOG-BAN LENS-FABRICBAND - 1011072,HONEYWELL,1011072,,1,90044901,18,no,3049
72,HONEYWELL DURAMAXX CLR DURA FAB - 1017750,HONEYWELL,1017750,,1,90044901,18,no,3049
73,HONEYWELL DURAMAXX CLR DURA NEOPR - 1017751,HONEYWELL,1017751,,1,90044901,18,no,3049
74,HONEYWELL HONEYWELL MAXXPRO  HS AF RPLT LNS - 1011070HS,HONEYWELL,1011070HS,,1,90044901,18,no,3049
75,HONEYWELL HW MAXX-PRO GOGGLE CLR HSAF NEO - 1011071HS,HONEYWELL,1011071HS,,1,90044901,18,no,3049
76,HONEYWELL HW MAXX-PRO GOGGLE CLR HSAF FAB - 1011072HS,HONEYWELL,1011072HS,,1,90044901,18,no,3049
77,HONEYWELL GAMADOR 90X110 W/O LENS - 810450,HONEYWELL,810450,,1,65066101,18,no,3059
78,HONEYWELL LAMADOR 90X110 COMBI NORTH - 810550.2,HONEYWELL,810550.2,,1,65066101,18,no,3059
79,HONEYWELL TIGERHOOD 2999 ADF4-9/13 - 812920,HONEYWELL,812920,,1,65066101,18,no,3059
80,HONEYWELL SUPERVIZOR ATTACHMENT SA660/EU - 1002302,HONEYWELL,1002302,,1,39266101,18,no,3059
81,"HONEYWELL Triacetate Visors, SV9TC5WP Visor, Clear - 1002323",HONEYWELL,1002323,,1,39266101,18,no,3059
82,HONEYWELL SUPERVIZOR SCREEN SV9A/5W/EU - 1002330,HONEYWELL,1002330,,1,39266101,18,no,3059
83,HONEYWELL CLEARWAYS HEADBAND CB20/EU - 1002341,HONEYWELL,1002341,,1,39266101,18,no,3059
84,HONEYWELL CLEARWAYS VISOR CV83P/EU - 1002353,HONEYWELL,1002353,,1,39266101,18,no,3059
85,HONEYWELL HON BIONIC Faceshield w/Uncoat Visor - 1011623,HONEYWELL,1011623,,1,39266101,18,no,3059
86,HONEYWELL HONEYWELL BIONIC FS CL PC HCFB - 1011624,HONEYWELL,1011624,,1,39266101,18,no,3059
87,HONEYWELL HON BIONIC CLEAR UNCOAT VISOR FCSHLD - 1011625,HONEYWELL,1011625,,1,39266101,18,no,3059
88,HONEYWELL HONEYWELL BIONIC CL ACET UNCT - 1011933,HONEYWELL,1011933,,1,39266101,18,no,3059
89,HONEYWELL HONEYWELL BIONIC HDHAT ADAPTER - 1015161,HONEYWELL,1015161,,1,39266101,18,no,3059
90,HONEYWELL TURBOSHIELD HEADGEAR - 1031740,HONEYWELL,1031740,,1,39266101,18,no,3059
91,HONEYWELL SPERIAN CLEAR PC TURBOSHIELD UNCOAT - 1031743,HONEYWELL,1031743,,1,39266101,18,no,3059
92,HONEYWELL SPERIAN CLEAR PC TURBOSHIELD ANTI-FOG - 1031744,HONEYWELL,1031744,,1,39266101,18,no,3059
93,HONEYWELL SPERIAN GREY TURBOSHIELD HARDCOAT/ANTIFG - 1031746,HONEYWELL,1031746,,1,39266101,18,no,3059
94,HONEYWELL V40 HEADGEAR/ALUM BRACKET - 11380029,HONEYWELL,11380029,,1,39266101,18,no,3059
95,HONEYWELL M865U SH5 PROP VISOR - 11390068,HONEYWELL,11390068,,1,39266101,18,no,3059
96,HONEYWELL HEADGEAR 3C - 3C,HONEYWELL,3C,,1,65066101,18,no,3059
97,HONEYWELL WNDW 4178 CLEAR - 4178CL,HONEYWELL,4178CL,,1,39266101,18,no,3059
98,HONEYWELL WNDW 4178 IR/UV SH#5 - 4178IRUV5,HONEYWELL,4178IRUV5,,1,39266101,18,no,3059
99,HONEYWELL WNDW 4178 IR/UV SH 8 - 4178IRUV8,HONEYWELL,4178IRUV8,,1,39266101,18,no,3059
100,HONEYWELL WNDW 4199 GOLD TVGY - 4199GDTVGY,HONEYWELL,4199GDTVGY,,1,39266101,18,no,3059
101,HONEYWELL HLMT 906 GRAY SH10 PC - 906GY,HONEYWELL,906GY,,1,65066101,18,no,3059
102,HONEYWELL BRACKET ALUMINUM FOR A79 - CP5004,HONEYWELL,CP5004,,1,76166100,18,no,3059
103,HONEYWELL BRACKET PLASTIC UNIVERSAL SLOT - CP5005,HONEYWELL,CP5005,,1,39266101,18,no,3059
104,HONEYWELL FCSHLD F400 - F400,HONEYWELL,F400,,1,39266101,18,no,3059
105,HONEYWELL FCSHLD FH66 - FH66,HONEYWELL,FH66,,1,39266101,18,no,3059
106,HONEYWELL FCSHLD FM-500-DC CLEAR - FM500DCCL,HONEYWELL,FM500DCCL,,1,39266101,18,no,3059
107,HONEYWELL FCSHLD FM70 - FM70,HONEYWELL,FM70,,1,39266101,18,no,3059
108,"HONEYWELL SH 10 WELDING HELMET, BLACK - HW100",HONEYWELL,HW100,,1,65066101,18,no,3059
109,"HONEYWELL SH 9-13 WELDING HELMET, BLACK - HW200",HONEYWELL,HW200,,1,65066101,18,no,3059
110,"HONEYWELL COVER PLATE, PC, 90X110 5X - PC90110",HONEYWELL,PC90110,,1,39266101,18,no,3059
111,HONEYWELL Combination Emergency Shower and Eyewash Station - 7210,HONEYWELL,7210,,1,39266101,18,no,3049
112,"HONEYWELL Porta Stream I, English - 32-000100-0000",HONEYWELL,32-000100-0000,,1,39266101,18,no,3049
113,"HONEYWELL Pull Strap f/PS I,II,III - 32-000102-0000",HONEYWELL,32-000102-0000,,1,39266101,18,no,3049
114,"HONEYWELL Porta Stream II, English - 32-000200-0000",HONEYWELL,32-000200-0000,,1,39266101,18,no,3049
115,"HONEYWELL Porta Stream II,w/Additive - 32-000230-0000",HONEYWELL,32-000230-0000,,1,39266101,18,no,3049
116,"HONEYWELL Bottle Mounting Device, 4 pa - 32-000435-0000",HONEYWELL,32-000435-0000,,1,39266101,18,no,3049
117,HONEYWELL SPERIAN STERILE EYEWASH BOTTLES-16 OZ. - 32-000454-0000,HONEYWELL,32-000454-0000,,1,25011001,-,no,3049
118,HONEYWELL SPERIAN STERILE EYEWASH BOTTLES-32 OZ. - 32-000455-0000,HONEYWELL,32-000455-0000,,1,25011001,-,no,3049
119,HONEYWELL SPERIAN 16OZ SINGLE EYEWASH WALL STATION - 32-000460-0000,HONEYWELL,32-000460-0000,,1,39266101,18,no,3049
120,HONEYWELL EYESALINE SGL 32OZ WS 8/CASE - 32-000461-0000,HONEYWELL,32-000461-0000,,1,39266101,18,no,3049
121,HONEYWELL SPERIAN 32Oz Double Eyewash Wall Station - 32-000462-0000,HONEYWELL,32-000462-0000,,1,39266101,18,no,3049
122,HONEYWELL DOUBLE 16OZ WALL STATION4/CS - 32-000465-0000,HONEYWELL,32-000465-0000,,1,39266101,18,no,3049
123,HONEYWELL SPERIAN EYESALINE CONCENTRATE FOR #100 - 32-000509-0000,HONEYWELL,32-000509-0000,,1,25011001,-,no,3049
124,HONEYWELL SPERIAN EYESALINE CONCENTRATE #200 & 300 - 32-000513-0000,HONEYWELL,32-000513-0000,,1,25011001,-,no,3049
125,HONEYWELL SPERIAN Fendall PureFlow SalineCartridge - 32-001050-0000,HONEYWELL,32-001050-0000,,1,25011001,-,no,3049
126,"HONEYWELL WATER ADDITIVE, 8OZ,4/CS - 32-001100-0000",HONEYWELL,32-001100-0000,,1,25011001,-,no,3049
127,HONEYWELL Sterile Eyesaline Cartridge for Fendall 2000 - 32-ST2050-0000,HONEYWELL,32-ST2050-0000,,1,33077101,18,no,3049
128,HONEYWELL SPECTACLE RETAINER BLACK - 1005771,HONEYWELL,1005771,,1,73089098,18,no,3049
129,HONEYWELL MILLENNIA CASE - 1008060,HONEYWELL,1008060,,1,90044901,18,no,3049
130,HONEYWELL SPERIAN CLEAR 500ML SPRAY BOTTLE-CASE - 1011378,HONEYWELL,1011378,,1,90044901,18,no,3049
131,"HONEYWELL CLEAR TISSUES 500 EACH / BOX, 60 BX/CS - 1011379",HONEYWELL,1011379,,1,48188100,18,no,3049
132,"HONEYWELL SWEATBAND, PK OF 10 - A161472",HONEYWELL,A161472,,1,65066101,18,no,3049
133,HONEYWELL PERCAP FOLDABLE HEARING BAND EU - 1005952,HONEYWELL,1005952,,1,39266101,18,no,1290
134,HONEYWELL HOWARD LEIGHT PERCAP REPLAC. PODS X10P - 1005980,HONEYWELL,1005980,,1,40166100,18,no,1290
135,HONEYWELL 304L CORDED EARPLUG 1CS=500Pairs - 1000106,HONEYWELL,1000106,,1,40166100,18,no,1290
136,HONEYWELL 303L EARPLUG 1PR POUCH(1CS=2000PRs) - 1005073,HONEYWELL,1005073,,1,40166100,18,no,1290
137,HONEYWELL 303L FOAMPLUG - 2000pairs/c - 1006186,HONEYWELL,1006186,,1,40166100,18,no,1290
138,HONEYWELL BILSOM 303L 500 PAIR DISPENSER REFILL - 1017573,HONEYWELL,1017573,,1,40166100,18,no,1290
139,HONEYWELL BILSOM 303S 500 PAIR DISPENSER REFILL - 1017574,HONEYWELL,1017574,,1,40166100,18,no,1290
140,HONEYWELL SPERIAN AIRSOFT EARPLUG WHITECORD(50PRs) - 1030611,HONEYWELL,1030611,,1,40166100,18,no,1290
141,HONEYWELL SPERIAN AIRSOFT EARPLUG REDCORD(50PRs) - 1030612,HONEYWELL,1030612,,1,40166100,18,no,1290
142,HONEYWELL Howard Leight MAX CORDED EARPLUG 100PRS - 3301130,HONEYWELL,3301130,,1,40166100,18,no,1290
143,HONEYWELL Howard Leight LASER TRAK DETECT. 100PRS - 3301167,HONEYWELL,3301167,,1,40166100,18,no,1290
144,HONEYWELL Howard Leight LASER LITE REFILL LS500 - 3301271,HONEYWELL,3301271,,1,40166100,18,no,1290
145,HONEYWELL LASER LITE-LS-500 DISPNSR REFILL - LL-1-D,HONEYWELL,LL-1-D,,1,40166100,18,no,1290
146,HONEYWELL MAX-UNCORDED EARPLUGS (SAP 3301161) - MAX-1,HONEYWELL,MAX-1,,1,40166100,18,no,1290
147,"HONEYWELL MAX-DISP.REFILL,500 PR (SAP 3301165) - MAX-1-D",HONEYWELL,MAX-1-D,,1,40166100,18,no,1290
148,HONEYWELL MAX-CORDED EARPLUGS (SAP 3301130) - MAX-30,HONEYWELL,MAX-30,,1,40166100,18,no,1290
149,"HONEYWELL LEIGHT SLEEPERS,10pr HBC PAK - R-01680",HONEYWELL,R-01680,,1,40166100,18,no,1290
150,"HONEYWELL AQUASEAL,HBC, 2 PK - R-01684",HONEYWELL,R-01684,,1,40166100,18,no,1290
151,"HONEYWELL SMARTFIT-CORDED,HEARPACK - SMF-30",HONEYWELL,SMF-30,,1,40166100,18,no,1290
152,HONEYWELL SMARTFIT-CORDED BIO-PACK - SMF-30W-P,HONEYWELL,SMF-30W-P,,1,40166100,18,no,1290
153,HONEYWELL Howard Leight DISPENSER LS400 WITH 303L - 1006202,HONEYWELL,1006202,,1,40166100,18,no,1290
154,HONEYWELL Howard Leight DISPENSER LS400 WITH 303S - 1006203,HONEYWELL,1006203,,1,39266101,18,no,1290
155,HONEYWELL HOWARD LEIGHT DISPENSER LS400 - 1013040,HONEYWELL,1013040,,1,39266101,18,no,1290
156,HONEYWELL Howard Leight LS500 DISPENSER - 3301273,HONEYWELL,3301273,,1,39266101,18,no,1290
157,HONEYWELL HL400-F DISPENSER FRAME SYSTEM ONLY - 50129758-001,HONEYWELL,50129758-001,,1,39266101,18,no,1290
158,HONEYWELL HL400 LITE DISPENSER SYSTEM ONLY - 50129759-001,HONEYWELL,50129759-001,,1,39266101,18,no,1290
159,HONEYWELL DISPENSER LIGHT FRAME HL400 AMERICA - HL400,HONEYWELL,HL400,,1,39266101,18,no,1290
160,HONEYWELL DISPENSER-LEIGHT SOURCE - LS-400,HONEYWELL,LS-400,,1,39266101,18,no,1290
161,"HONEYWELL DISPENSER-LEIGHT EARPLUG,BLUE - LS-500",HONEYWELL,LS-500,,1,39266101,18,no,1290
162,HONEYWELL BELT CASE FOLDABLE EARMUFF - 1000251,HONEYWELL,1000251,,1,39266101,18,no,1290
163,HONEYWELL COOL PADS-100PR ROLL DISPENSER - 1000364,HONEYWELL,1000364,,1,40166100,18,no,1290
164,HONEYWELL Howard Leight HYGIENE KIT C2/C3/C3H - 1006081,HONEYWELL,1006081,,1,39266101,18,no,1290
165,HONEYWELL Howard Leight HYGIENE KIT THUNDER T1 - 1010974,HONEYWELL,1010974,,1,39266101,18,no,1290
166,HONEYWELL Howard Leight HYGIENE KIT THUNDER T2 - 1010975,HONEYWELL,1010975,,1,39266101,18,no,1290
167,HONEYWELL Howard Leight HYGIENE KIT THUNDER T3 - 1010976,HONEYWELL,1010976,,1,39266101,18,no,1290
168,HONEYWELL Howard Leight HYGIENE KIT LEIGHTNING L2s - 1011999,HONEYWELL,1011999,,1,39266101,18,no,1290
169,HONEYWELL IMPACT SPORT BLACK - 1030942,HONEYWELL,1030942,,1,39266101,18,no,1290
170,"HONEYWELL EARMUFF-IMPACT SPORT,GREEN,US - R-01526",HONEYWELL,R-01526,,1,39266101,18,no,1290
171,"HONEYWELL EARMUFF,SYNC STEREO,BLACK,US/AUS/NZ - 1030110",HONEYWELL,1030110,,1,39266101,18,no,1290
172,"HONEYWELL EARMUFF,SYNC AM/FM,RADIO,US - 1030331",HONEYWELL,1030331,,1,39266101,18,no,1290
173,HONEYWELL HOWARD LEIGHT SYNC DIGITAL ELECTO - 1030333,HONEYWELL,1030333,,1,39266101,18,no,1290
174,HONEYWELL HLI SYNC DIGITAL ELECTO-H EARCUPS - 1030334,HONEYWELL,1030334,,1,39266101,18,no,1290
175,"HONEYWELL EARMUFF,SYNC AM/FM,RADIO,HV,US - 1030390",HONEYWELL,1030390,,1,39266101,18,no,1290
176,HONEYWELL QP100EX - 'KIT B' - 1030836,HONEYWELL,1030836,,1,39266101,18,no,1290
177,"HONEYWELL EARMUFF, SYNC WIRELESS - 1030945",HONEYWELL,1030945,,1,39266101,18,no,1290
178,HONEYWELL QP100EX 'KIT C' - 1031323,HONEYWELL,1031323,,1,39266101,18,no,1290
179,HONEYWELL MACH 1 EARMUFF (20EA/CS) - 1010421,HONEYWELL,1010421,,1,39266101,18,no,1290
180,HONEYWELL EARMUFF LEIGHTNING L3 (20EA/CS) - 1010924,HONEYWELL,1010924,,1,39266101,18,no,1290
181,"HONEYWELL EARMUFF,THUNDER T1 - 1010928",HONEYWELL,1010928,,1,39266101,18,no,1290
182,"HONEYWELL EARMUFF,CLARITY C1 (SEE #1011142-H5) - 1011142",HONEYWELL,1011142,,1,39266101,18,no,1290
183,"HONEYWELL EARMUFF,CLARITY C3 - 1011146",HONEYWELL,1011146,,1,39266101,18,no,1290
184,HONEYWELL EARMUFF-CLARITY C3 HELMET - 1011264,HONEYWELL,1011264,,1,39266101,18,no,1290
185,HONEYWELL Howard Leight THUNDER T1 FOLDABLE MUFF - 1011600,HONEYWELL,1011600,,1,39266101,18,no,1290
186,"HONEYWELL EARMUFF,THUNDER T3,HELMET - 1011603",HONEYWELL,1011603,,1,39266101,18,no,1290
187,"HONEYWELL EARMUFF,LEIGHTNING L2N - 1011995",HONEYWELL,1011995,,1,39266101,18,no,1290
188,"HONEYWELL EARMUFF,LEIGHTNING L3N - 1011996",HONEYWELL,1011996,,1,39266101,18,no,1290
189,HONEYWELL Howard Leight THUNDER T1H ad3712-11-21 - 1012533,HONEYWELL,1012533,,1,39266101,18,no,1290
190,"HONEYWELL EARMUFF-THUNDER T2H,EU - 1012534",HONEYWELL,1012534,,1,39266101,18,no,1290
191,HONEYWELL EARMUFF-LEIGHTNING L3H - 1012541,HONEYWELL,1012541,,1,39266101,18,no,1290
192,"HONEYWELL EARMUFF-L2F, HI-VIS - 1013942",HONEYWELL,1013942,,1,39266101,18,no,1290
193,HONEYWELL HOWARD LEIGHT THUNDER T3 MUFF - 1010970-H5,HONEYWELL,1010970-H5,,1,39266101,18,no,1290
194,"HONEYWELL QUIET MUFF, QM24+  (SAP 3302152) - QM24PLUS",HONEYWELL,QM24PLUS,,1,39266101,18,no,1290
195,HONEWELL WATER-JEL FIRE BLKT/CNST 6'X5' - 049020CL,HONEYWELL,049020CL,,1,39266102,12,no,3097
196,HONEWELL PM 2.5 for global sale IAQ - HAQEOW_R,HONEYWELL,HAQEOW_R,,1,39266101,18,no,3097
197,HONEWELL HASP 5 1/4IN LG 6 PAD RD - 666RD,HONEYWELL,666RD,,1,73266110,18,no,3097
198,HONEWELL LOCKOUT   BALL VALVE  SM  BL - BS01B,HONEYWELL,BS01B,,1,39266101,18,no,3097
199,HONEWELL LOCKOUT  BALL VALVE  SM  GR - BS01G,HONEYWELL,BS01G,,1,39266101,18,no,3097
200,HONEWELL LOCKOUT  BALL VALVE  SM  RD - BS01R,HONEYWELL,BS01R,,1,39266101,18,no,3097
201,"HONEWELL VALVE LOCKOUT 3/8""-1 1/4""RED - BS01RP",HONEYWELL,BS01RP,,1,39266101,18,no,3097
202,HONEWELL LOCKOUT  BALL VALVE  SM  YW - BS01Y,HONEYWELL,BS01Y,,1,39266101,18,no,3097
203,HONEWELL LOCKOUT  BALL VALVE  MD  BL - BS02B,HONEYWELL,BS02B,,1,39266101,18,no,3097
204,HONEWELL LOCKOUT  BALL VALVE  MD  GR - BS02G,HONEYWELL,BS02G,,1,39266101,18,no,3097
205,HONEWELL LOCKOUT  BALL VALVE  MD  RD - BS02R,HONEYWELL,BS02R,,1,39266101,18,no,3097
206,"HONEWELL VALVE LOCKOUT 1.5""-2.5"" RED - BS02RP",HONEYWELL,BS02RP,,1,39266101,18,no,3097
207,HONEWELL LOCKOUT  BALL VALVE  MD  YW - BS02Y,HONEYWELL,BS02Y,,1,39266101,18,no,3097
208,HONEWELL LOCKOUT  BALL VALVE  LG  BL - BS03B,HONEYWELL,BS03B,,1,39266101,18,no,3097
209,HONEWELL LOCKOUT  BALL VALVE  LG  GR - BS03G,HONEYWELL,BS03G,,1,39266101,18,no,3097
210,HONEWELL LOCKOUT  BALL VALVE  LG  RD - BS03R,HONEYWELL,BS03R,,1,39266101,18,no,3097
211,"HONEWELL VALVE LOCKOUT 2""-8""RED - BS03RP",HONEYWELL,BS03RP,,1,39266101,18,no,3097
212,HONEWELL LOCKOUT  BALL VALVE  LG  YW - BS03Y,HONEYWELL,BS03Y,,1,39266101,18,no,3097
213,"HONEWELL BUTTERFLY,UNIVER,BLUE - BS04B",HONEYWELL,BS04B,,1,39266101,18,no,3097
214,"HONEWELL BUTTERFLY,UNIVER,GREEN - BS04G",HONEYWELL,BS04G,,1,39266101,18,no,3097
215,"HONEWELL BUTTERFLY,UNIVER,RED - BS04R",HONEYWELL,BS04R,,1,39266101,18,no,3097
216,"HONEWELL BUTTERFLY,UNIVER,RED BULK - BS04RP",HONEYWELL,BS04RP,,1,39266101,18,no,3097
217,"HONEWELL BUTTERFLY,UNIVER,YELLOW - BS04Y",HONEYWELL,BS04Y,,1,39266101,18,no,3097
218,HONEWELL LOCKOUT BREAKER  SINGLE REQ SW - CB01,HONEYWELL,CB01,,1,39266101,18,no,3097
219,HONEWELL LOCKOUT  BREAKER DOUBLE REQ SW - CB02,HONEYWELL,CB02,,1,39266101,18,no,3097
220,HONEWELL LOCKOUT CIRCUIT BREAKER SINGLE - CB03,HONEYWELL,CB03,,1,39266101,18,no,3097
221,HONEWELL LOCKOUT CIRCUIT BREAKER DOUBLE - CB04,HONEYWELL,CB04,,1,39266101,18,no,3097
222,"HONEWELL CABLE 6',REPLACMENT - CBL06",HONEYWELL,CBL06,,1,39266101,18,no,3097
223,"HONEWELL CABLE 10', REPLACEMENT - CBL10",HONEYWELL,CBL10,,1,39266101,18,no,3097
224,"HONEWELL LOCKOUT,CABLE 6' - CBLOK06R",HONEYWELL,CBLOK06R,,1,39266101,18,no,3097
225,HONEWELL CIRCUIT BREAKER LOCKOUT - CBU01,HONEYWELL,CBU01,,1,39266101,18,no,3097
226,"HONEWELL LOCK BOX,GROUP ,RED - GLB01",HONEYWELL,GLB01,,1,39266101,18,no,3097
227,HONEWELL L/O KIT WITH CARRY CASE - LK107FE,HONEYWELL,LK107FE,,1,39266102,18,no,3097
228,HONEWELL KIT LOCKOUT VALVE / TAGOUT - LK109FE,HONEYWELL,LK109FE,,1,39266103,18,no,3097
229,HONEWELL COMBINATION L/O KIT - LK110FE,HONEYWELL,LK110FE,,1,39266101,18,no,3097
230,HONEWELL POUCH ELECTRICAL LOCKOUT / TAG - LK111FE,HONEYWELL,LK111FE,,1,90271000,18,no,3097
231,HONEWELL POUCH BREAKER LOCKOUT - LK112F,HONEYWELL,LK112F,,1,39266101,18,no,3097
232,"HONEWELL PLUG LOCK,110VOLT - LP110",HONEYWELL,LP110,,1,39266101,18,no,3097
233,HONEWELL PLUG LOCK 220VOLT - LP550,HONEYWELL,LP550,,1,39266101,18,no,3097
234,HONEWELL LOCKOUT STATION COMPLETE SMALL - LSE101F,HONEYWELL,LSE101F,,1,39266101,18,no,3097
235,HONEWELL LOTO STATION COMPLETE LARGE - LSE102F,HONEYWELL,LSE102F,,1,39266101,18,no,3097
236,HONEWELL LOTO COMPLETE STATION 4 - LSE104F,HONEYWELL,LSE104F,,1,39266101,18,no,3097
237,HONEWELL LOTO STATION 10 EMPTY PANEL - LSE105,HONEYWELL,LSE105,,1,39266101,18,no,3097
238,HONEWELL LOTO COMPLETE STATION 10 - LSE105F,HONEYWELL,LSE105F,,1,90271000,18,no,3097
239,HONEWELL LOTO DEPART COMPLETE STATION - LSE106F,HONEYWELL,LSE106F,,1,39266101,18,no,3097
240,HONEWELL NYLON LO HASP HI VIZ - MS01,HONEYWELL,MS01,,1,39266101,18,no,3097
241,HONEWELL M-SAFE LOCKOUT HASP 4 3/8 - MS86,HONEYWELL,MS86,,1,39266101,18,no,3097
242,HONEWELL LOCKOUT HASP 4 3/8IN LG 6 PADL - R60ML,HONEYWELL,R60ML,,1,39266101,18,no,3097
243,"HONEWELL VALVE LOCK TO 2 1/2"" RED - VS02R",HONEYWELL,VS02R,,1,39266101,18,no,3097
244,"HONEWELL VALVE LOCK TO 2 1/2-5"",RED - VS04R",HONEYWELL,VS04R,,1,39266101,18,no,3097
245,"HONEWELL VALVE LOCK 5-6 1/2"",RED - VS06R",HONEYWELL,VS06R,,1,39266101,18,no,3097
246,"HONEWELL VALVE LOCK 6 1/2-10"",RED - VS09R",HONEYWELL,VS09R,,1,39266101,18,no,3097
247,"HONEWELL VALVE LOCK 10-14"",BLUE - VS13B",HONEYWELL,VS13B,,1,39266101,18,no,3097
248,"HONEWELL VALVE LOCK 10-14"",GREEN - VS13G",HONEYWELL,VS13G,,1,39266101,18,no,3097
249,"HONEWELL VALVE LOCK 10-14"",RED - VS13R",HONEYWELL,VS13R,,1,39266101,18,no,3097
250,"HONEWELL VALVE LOCK 10-14"",YELLOW - VS13Y",HONEYWELL,VS13Y,,1,39266101,18,no,3097
251,HONEWELL 3LTH3 ELECTRICAL L/OT/O KIT - ZLK108FE,HONEYWELL,ZLK108FE,,1,39266101,18,no,3097
252,HONEYWELL ASCENDER ESD S3 CI SRC - 6243857-41/7,HONEYWELL,6243857-41/7,,1,64033120,18,no,3129
253,HONEYWELL ASCENDER ESD S3 CI SRC - 6243857-42/7,HONEYWELL,6243857-42/7,,1,64033120,18,no,3129
254,HONEYWELL ASCENDER ESD S3 CI SRC - 6243857-43/7,HONEYWELL,6243857-43/7,,1,64033120,18,no,3129
255,HONEYWELL ASCENDER ESD S3 CI SRC - 6243857-44/7,HONEYWELL,6243857-44/7,,1,64033120,18,no,3129
256,HONEYWELL ASCENDER ESD S3 CI SRC - 6243857-45/7,HONEYWELL,6243857-45/7,,1,64033120,18,no,3129
257,HONEYWELL ASCENDER ESD S3 CI SRC - 6243857-46/7,HONEYWELL,6243857-46/7,,1,64033120,18,no,3129
258,HONEYWELL ASCENDER S3 CI SRC - 6243850-38/7,HONEYWELL,6243850-38/7,,1,64033120,18,no,3129
259,HONEYWELL ASCENDER MID S3 CI SRC - 6243851-38/7,HONEYWELL,6243851-38/7,,1,64033120,18,no,3129
260,HONEYWELL ASCENDER MID S3 CI SRC - 6243851-39/7,HONEYWELL,6243851-39/7,,1,64033120,18,no,3129
261,HONEYWELL ASCENDER MID S3 CI SRC - 6243851-40/7,HONEYWELL,6243851-40/7,,1,64033120,18,no,3129
262,HONEYWELL ASCENDER MID S3 CI SRC - 6243851-41/7,HONEYWELL,6243851-41/7,,1,64033120,18,no,3129
263,HONEYWELL ASCENDER MID S3 CI SRC - 6243851-42/7,HONEYWELL,6243851-42/7,,1,64033120,18,no,3129
264,HONEYWELL ASCENDER MID S3 CI SRC - 6243851-43/7,HONEYWELL,6243851-43/7,,1,64033120,18,no,3129
265,HONEYWELL ASCENDER MID S3 CI SRC - 6243851-44/7,HONEYWELL,6243851-44/7,,1,64033120,18,no,3129
266,HONEYWELL BOOSTER BLACK S1P CI SRC - 6243853-41/7,HONEYWELL,6243853-41/7,,1,64033120,18,no,3129
267,"HONEYWELL KING'S KWD706 - Men's Series, Steel Toe - KWD706",HONEYWELL,KWD706,,1,64033120,18,no,3129
268,HONEYWELL Full grain leather slip-on shoe Colour: Black Size : 3 - 13 - KWD807,HONEYWELL,KWD807,,1,64033120,18,no,3129
269,HONEYWELL Full grain leather laced boot High Ankle - KWD912,HONEYWELL,KWD912,,1,64033120,18,no,3129
270,HONEYWELL KINGS SAFETY SHOE COMFORT RANGE SIZE-10 - KWS800-10,HONEYWELL,KWS800-10,,1,64033120,18,no,3129
